"ProductId","Image Url","Video Url","Product Desc","Origin Price","Discount Price","Discount","Currency","Commission Rate","Commission","Sales180Day","Positive Feedback","Promotion Url"
"1005004739137470","https://ae04.alicdn.com/kf/Sa73639e7b53844e4805ab56a7c124d9cP.jpg",,"Collection Electronic Toy Digital Monster D4 Three Colors Gaming Machine Game Players Nostalgic Game Greymon Console Electronic","USD 19.75","USD 15.80","20%","USD","7","USD 1.11","1","null%","https://s.click.aliexpress.com/e/_DClXrmr"
"1005003977935965","https://ae04.alicdn.com/kf/S77b73df01416432c95876f56cdaaef3dA.jpg",,"1PC /5PCs Transparent Electronic Pets Tamagotchi  Nostalgic 49 Pets In One Virtual Cyber Digital Pet Toys Pixel Funny Play Toys","USD 2.50","USD 2.50","0%","USD","7","USD 0.18","7","100.0%","https://s.click.aliexpress.com/e/_DeR9MDD"
"1005004464943612","https://ae04.alicdn.com/kf/S2f65c70c384147c09390e658cb830120v.jpg",,"Early Learning Electronic Book Language Reading Book Interactive Electronic Language Book Reading Cognitive Games Toys For","USD 25.02","USD 12.51","50%","USD","7","USD 0.88","0","null%","https://s.click.aliexpress.com/e/_DE2fDFv"
"1005003255191892","https://ae04.alicdn.com/kf/Hba19392657694e78856aa67524a681d6t.jpg","http://cloud.video.taobao.com/play/u/2675628091/p/1/e/6/t/1/325220184479.mp4","Wooden Tank Electronic DIY Handmade Building Toy Electric Kids Tank Educational Experimental Model Kit Puzzle For Boys Birthday","USD 24.00","USD 14.40","40%","USD","8.0","USD 1.15","0","null%","https://s.click.aliexpress.com/e/_DmkTP9d"
"1005001286781536","https://ae04.alicdn.com/kf/H1627744c851c43c18aaa70354ef7dd32X.jpg",,"Novelty Voice Controlled Bird Call Chirp Electronic Pet Gag Kids Baby Toy 63HE","USD 0.63","USD 0.44","30%","USD","7","USD 0.03","0","null%","https://s.click.aliexpress.com/e/_DkMqogP"
"1005003033777152","https://ae04.alicdn.com/kf/H3e96b52f711848148e9955467deea32dH.jpg","http://cloud.video.taobao.com/play/u/2675628091/p/1/e/6/t/1/318794724143.mp4","Electric Dance Duck Lighting Educational Dancing Toy Interactive Dancing Little Yellow Duck Toys Musical Interactive Kids Gifts","USD 5.35","USD 3.10","42%","USD","7","USD 0.22","1","null%","https://s.click.aliexpress.com/e/_DBX2UQx"
"1005004072769428","https://ae04.alicdn.com/kf/S0b12779c23f34fdd812a29af3c83d3b2j.jpg",,"2022 Hot Tamagot Electronic Pets Toys Keyring Educational Funny Virtual Cyber Pet Toy Gift Christmas Pets Toys 1pc","USD 1.24","USD 0.87","30%","USD","7","USD 0.06","14","100.0%","https://s.click.aliexpress.com/e/_DFPkXLt"
"1005004062735871","https://ae04.alicdn.com/kf/S7c19d0e23383471890eb5c8fc543fea6K.jpg",,"Funny Solid Color 90S Nostalgic Virtual Cyber Pet Toy Electronic Pets Gift Keyring Pets Toys Gift Electronic Toys","USD 3.28","USD 1.97","40%","USD","7","USD 0.14","2","null%","https://s.click.aliexpress.com/e/_DBeAqwL"
"1005003937309126","https://ae04.alicdn.com/kf/S87f6f70745b44f969bf29b14928fcd6aE.jpg",,"Cognitive Ability Plush Battery-operated Mechanical Plush Kitty  Toy Stuffed Electric Cat Toy for Kids","USD 3.92","USD 2.94","25%","USD","9.0","USD 0.26","0","null%","https://s.click.aliexpress.com/e/_Dl6SKhv"
"1005004562631326","https://ae04.alicdn.com/kf/S7bf19ef262f2480abcf9f03dc8bda3a4a.jpg",,"Crawling Crab Baby Toys With Music LED Light Up Musical Toys For Toddler Automatically Avoid Obstacles Interactive Toys For Kids","USD 6.94","USD 2.78","60%","USD","7","USD 0.19","0","null%","https://s.click.aliexpress.com/e/_DFa3tn1"
"1005004543355814","https://ae04.alicdn.com/kf/S4816804b19814c34aecf262d5065fd92D.jpg",,"Puzzle Music Block Electronic Music Cube Toys Early Education Toy For Children Kids Toddlers Single / Multiplayer Modes","USD 1.37","USD 0.96","30%","USD","7","USD 0.07","0","null%","https://s.click.aliexpress.com/e/_DBnoXpV"
"1005003852770758","https://ae04.alicdn.com/kf/S5b93cdf00e914540be4b8460fef963b6v.jpg",,"Moose Little Live Pets Figur Surprise Chick- Sortiert Children Toys Plush Toys Electronic Soft Animal Toys Kawaii Birthday Gift","USD 40.00","USD 22.00","45%","USD","8.0","USD 1.76","10","100.0%","https://s.click.aliexpress.com/e/_Dm35e23"
"1005004044633584","https://ae04.alicdn.com/kf/S6e164226cf6d41b8bdb9a12d32dd91d4U.jpg","http://cloud.video.taobao.com/play/u/2675628091/p/1/e/6/t/1/352687499736.mp4","Electric Duck Climbing Stairs Slides Set with LED Flashing Lights Music Race Car Tracks Roller Coaster Kids Educational Toys","USD 3.50","USD 2.10","40%","USD","15.0","USD 0.32","12","100.0%","https://s.click.aliexpress.com/e/_DEPAfEB"
"1005004489829882","https://ae04.alicdn.com/kf/Sdb4d317cbc4f42a9bb333f63d501b7da9.jpg",,"Electronic Game Toy Pocket Game Console Classic Childhood For Gift Hand Held Game Player Lcd Game Palyer Built-in 23 Game P0j7","USD 1.88","USD 1.13","40%","USD","7","USD 0.08","0","null%","https://s.click.aliexpress.com/e/_Dd67PtN"
"1005003811084240","https://ae04.alicdn.com/kf/S535510b7d43b4ff6b70b21d805e7a927K.jpg","http://cloud.video.taobao.com/play/u/2675628091/p/1/e/6/t/1/346988230333.mp4","Electric Toy Little Yellow Duck Climbing Stair and Slide Toy Set with 9 Duck Toy & Race Track Roller Coaster Toy Children's Gift","USD 3.19","USD 2.52","21%","USD","7","USD 0.18","2","0.0%","https://s.click.aliexpress.com/e/_DCx9kMn"
"1005004547298806","https://ae04.alicdn.com/kf/S020a2f7242fd4e20865c458291a11b5fN.jpg","http://cloud.video.taobao.com/play/u/2675628091/p/1/e/6/t/1/1100068637505.mp4","USB Charging HD Color Screen Electronic Digital Pet Game Console 90S Nostalgic Virtual Cyber E-pet Interactive Toys Gift for 6Y","USD 19.84","USD 13.89","30%","USD","7","USD 0.97","1","null%","https://s.click.aliexpress.com/e/_DmIM5JD"
"1005004730623497","https://ae04.alicdn.com/kf/S1b746a3f148b4b6a9627f3ee0da5fdabp.jpg",,"Electronic Walking Dinosaur Toys Roaring Sound Lighting Mist Spray","USD 9.81","USD 5.98","39%","USD","7","USD 0.42","0","null%","https://s.click.aliexpress.com/e/_DERdIWx"
"4000154292882","https://ae04.alicdn.com/kf/Hba70b46cdbd846eeb3e5eca671b332d6e.jpg","http://cloud.video.taobao.com/play/u/2675628091/p/1/e/6/t/1/235633699564.mp4","Newest Cute Sequin Unicorn Electric Walking Unicorn Plush Toys Stuffed Animal Toy Electronic Music Unicorn Toy For Kid Gift","USD 16.63","USD 14.88","0%","USD","7","USD 1.04","5","100.0%","https://s.click.aliexpress.com/e/_DmIzvbt"
"1005004171033324","https://ae04.alicdn.com/kf/Sca7656245380499cb88789d9fed94bc0l.jpg","http://cloud.video.taobao.com/play/u/2675628091/p/1/e/6/t/1/1100084044630.mp4","Hot Sale Toy Electric Horse Music Walking Walk-around Lovely Pony Acousto-Optic Plaything Birthday Gift Toys for Children Baby","USD 3.35","USD 2.85","15%","USD","7","USD 0.20","0","null%","https://s.click.aliexpress.com/e/_DFUlSm7"
"1000005841004","https://ae04.alicdn.com/kf/S7beee128b28f46ab9fdf7a7baeff5605v.jpg","http://cloud.video.taobao.com/play/u/2675628091/p/1/e/6/t/1/1100007465798.mp4","Russian Learning people Machine Electronic Baby Alphabet Music Toy Educational Phonetic Chart Early Language Sound","USD 10.26","USD 8.72","15%","USD","8.0","USD 0.70","0","0.0%","https://s.click.aliexpress.com/e/_DeJixBp"
"1005004155420508","https://ae04.alicdn.com/kf/S5fea3634479f4c9499313c6b97dec095H.jpg",,"Electronic Pets Tamagot 90S Nostalgic 168 Pets In 1 Virtual Cyber Digital Toy Pixel Fun Play Kids Gift blue/purple/green/pink","USD 1.19","USD 0.83","30%","USD","7","USD 0.06","5","73.3%","https://s.click.aliexpress.com/e/_DdZNygJ"
"1005003447592590","https://ae04.alicdn.com/kf/H7d0da18efbe14ab8b269811d388e8181H.jpg",,"New Christmas Electric Toy Electronic Sax Santa Elk Snowman Robot Cute Interactive Toys Sing Twist Toys For Kids","USD 29.46","USD 17.68","40%","USD","8.0","USD 1.41","1","null%","https://s.click.aliexpress.com/e/_DDdEANh"
"1005004602960428","https://ae04.alicdn.com/kf/S4cfdef16f1824654a5e628933d89dad7V.jpg","http://cloud.video.taobao.com/play/u/2675628091/p/1/e/6/t/1/1100076197413.mp4","Electric Dancing Robots Toys Rock Light Music Early Education Walking Electric Pet Musical Shining Digital Pet Toys For Children","USD 23.63","USD 11.82","50%","USD","10.0","USD 1.18","0","null%","https://s.click.aliexpress.com/e/_DkhIDdH"
"1005004621693937","https://ae04.alicdn.com/kf/Sf486c7252f9048abb5e9eb168c4317012.jpg",,"Twist Head Different Sound Electronic Monkey Baby Pet Toy Fun House Girl & Boy Gift Mini Figure Game Original Design Finger toy","USD 13.05","USD 9.79","25%","USD","7","USD 0.69","0","null%","https://s.click.aliexpress.com/e/_DegyAsB"
"1005002689001292","https://ae04.alicdn.com/kf/Hd9df9d7e18cf415abdab61978df243c0B.jpg",,"Baby Phone Toy Mobile Telephone Early Educational Learning Machine Kids Gifts Telephone Music Sound Machine Electronic Baby Toy","USD 2.81","USD 1.26","55%","USD","7","USD 0.09","0","null%","https://s.click.aliexpress.com/e/_DBgKWZt"
"1005003721161798","https://ae04.alicdn.com/kf/Hadfe34d2385d4373a04145ff729ba951a.jpg",,"Electric Walking Dog Plush Toy Stuffed Animal Handle Control Electronic Music Puppy Toys for Children Christmas Gifts","USD 16.30","USD 9.94","39%","USD","7","USD 0.70","4","70.0%","https://s.click.aliexpress.com/e/_DeNp9z9"
"1005003033772761","https://ae04.alicdn.com/kf/Hf24208f5772748e8a0cfa5eb167554002.jpeg",,"Ferbie named Pixie, interractive, technology, hightech, hit, new, novelty 2021 hit backpack interactive toys for kids for boy girls Gifts Hobbies Baby Birthday children Electronic Pets","USD 34.26","USD 23.98","30%","USD","7","USD 1.68","7","60.0%","https://s.click.aliexpress.com/e/_DBSxXZz"
"1005002668026122","https://ae04.alicdn.com/kf/Haa8b21835e724c458859641f14f1c97fF.jpg",,"Creative Dinosaur Egg Shaped Electronic Pet Game Tamagotchi Toy 168 Pets In 1 Virtual Pet Electronic Toys Mini Handheld Game","USD 2.49","USD 1.99","20%","USD","7","USD 0.14","7","100.0%","https://s.click.aliexpress.com/e/_DDA3LaP"
"1005003737257934","https://ae04.alicdn.com/kf/S018f0b8e8a924c71b20750d6d2fa6116r.jpg",,"Electronic Toy For Babies Crawling Interactive Crawling Crab Toys With Music And Lights For Kids Baby Toddler Simulation Crab To","USD 13.27","USD 9.29","30%","USD","7","USD 0.65","3","100.0%","https://s.click.aliexpress.com/e/_DllbL2f"
"1005004206803900","https://ae04.alicdn.com/kf/S7075639669ac4d959bb9b55429aa0720z.jpg","http://cloud.video.taobao.com/play/u/2675628091/p/1/e/6/t/1/1100017042841.mp4","Baby Voice Control Rolling Toys For Children Music Dolls Kid's Toys Sound Controled Rolling Toys For Kids Interactive Toys Gift","USD 8.08","USD 4.20","48%","USD","9.0","USD 0.38","0","null%","https://s.click.aliexpress.com/e/_Dm294yR"
"4001061891447","https://ae04.alicdn.com/kf/H69868198f3ec44b3be9061d235ff9817d.jpg",,"New Electronic Trick-Playing Toy Electric Simulation Insect Crawl Vibration Toys","USD 1.19","USD 0.76","36%","USD","7","USD 0.05","0","0.0%","https://s.click.aliexpress.com/e/_DETR0qb"
"1005002171591916","https://ae04.alicdn.com/kf/He7d994ebf17440bf8afdc6463d7909ab3.jpg",,"Electric Pull Rope Pet Walking Sika Deer Animal Toy with LED Music Leash Interactive Kids Toy Children Birthday Gift","USD 1.97","USD 1.12","43%","USD","7","USD 0.08","0","null%","https://s.click.aliexpress.com/e/_DeUb4Sx"
"1005001977259481","https://ae04.alicdn.com/kf/Hc7562d188fd043768384ee9b4126c72cG.jpg","http://cloud.video.taobao.com/play/u/2675628091/p/1/e/6/t/1/335417214326.mp4","Realistic Plush Toy Simulation Cat Doll White Persian Cats Lifelike Kitten Model Birthday New Year Gift Home Decor Ornament","USD 12.71","USD 8.52","33%","USD","8.0","USD 0.68","7","100.0%","https://s.click.aliexpress.com/e/_DCftBvN"
"1005004417395532","https://ae04.alicdn.com/kf/Sa5bd80cb83b24bfbad07418682fc98a50.jpg","http://cloud.video.taobao.com/play/u/2675628091/p/1/e/6/t/1/1100051150444.mp4","Baby Voice Control Rolling Toys For Children Music Dolls Kid's Toys Sound Controled Rolling Toys For Kids Interactive Toys Gift","USD 5.21","USD 4.95","5%","USD","8.0","USD 0.40","0","null%","https://s.click.aliexpress.com/e/_DdiAs9t"
"32888050000","https://ae04.alicdn.com/kf/HTB1ilRPAbuWBuNjSszgq6z8jVXap.jpg",,"18cm Talking Koala Plush Toy Speak And Repeat Stuffed Electric Animal Soft Doll Electronic Koala Plush Baby Kids Toy","USD 10.80","USD 10.26","5%","USD","7","USD 0.72","28","100.0%","https://s.click.aliexpress.com/e/_DeuK2tZ"
"1005003192953035","https://ae04.alicdn.com/kf/H4f537e447f5645de8009038ce4a5fe1er.jpg",,"939A Pocket RC Robot Talking Interactive Dialogue Voice Recognition Record Singing Dancing Telling Story Mini RC Robot Toys Gift","USD 22.90","USD 11.91","48%","USD","8.0","USD 0.95","1","0.0%","https://s.click.aliexpress.com/e/_DBtftIP"
"1005003899545845","https://ae04.alicdn.com/kf/S7c8f537649eb4b8eab49187d3aad6d01b.jpg","http://cloud.video.taobao.com/play/u/2675628091/p/1/e/6/t/1/348486075134.mp4","Funny Electric Transparent Gear Simulation Snail Walking Lights Music Electronic Children Educational Toys Car Festival Gifts","USD 5.95","USD 4.76","20%","USD","7","USD 0.33","0","null%","https://s.click.aliexpress.com/e/_DDVBlmR"
"1005004702826207","https://ae04.alicdn.com/kf/S5fe4940350f641c7bcddcc0f76864a96X.jpg",,"Macaron-colored Mini Handheld Electronic Game Machine Puzzle Memory Training Interactive Game With Light Sound Children Fun Toys","USD 2.46","USD 1.94","21%","USD","7","USD 0.14","0","null%","https://s.click.aliexpress.com/e/_Dnc8moJ"
"1005003618268988","https://ae04.alicdn.com/kf/He0452badd5f94bd89d518c5bb6d78c0fs.jpg",,"Early Educational Learning Toys for Toddlers 3 4 5 Years Double-Side Flash Cards Electronic Interactive Preschool Reading","USD 11.29","USD 8.02","29%","USD","7","USD 0.56","0","null%","https://s.click.aliexpress.com/e/_DdvPz2X"
"1005003434270628","https://ae04.alicdn.com/kf/H227dbcac3e8f4320bb2270b8a8141a98O.jpg","http://cloud.video.taobao.com/play/u/2675628091/p/1/e/6/t/1/332770395291.mp4","Cute Swinging Magnetic Electric Swing Chicks Magnetic Walking Duckling Owl Chicken Toy Set Children Funny Educational Toys","USD 13.64","USD 9.55","30%","USD","8.0","USD 0.76","1","null%","https://s.click.aliexpress.com/e/_DmLnV4F"
"1005003923703881","https://ae04.alicdn.com/kf/Hf734f67f9eb14505a1ff9d3e6b37e11dG.jpg","http://cloud.video.taobao.com/play/u/2675628091/p/1/e/6/t/1/352551668067.mp4","Electric Duck Climbing Stairs Slides Set with LED Flashing Lights Music Race Car Tracks Roller Coaster Kids Educational Toys","USD 20.66","USD 12.40","40%","USD","7","USD 0.87","8","60.0%","https://s.click.aliexpress.com/e/_DDk165t"
"4000857404460","https://ae04.alicdn.com/kf/H6ce6f905ec504223ab2e163c53f9eb7a1.jpg",,"1 Pcs Flash Swimming Electronic Pet Robot Fish Bath Toys for Children Kids Battery Powered Swim Robotic Fishing Nemo Decoration","USD 2.85","USD 2.14","25%","USD","15.0","USD 0.32","19","86.7%","https://s.click.aliexpress.com/e/_DD9e4Kj"
"1005003397516975","https://ae04.alicdn.com/kf/H481319e068014726852e86bf182792acW.jpg",,"Electronic Talking Repeating Parrot Singing Chirping Bird with Motion Sensor Activation Pronunciation Electric Animal Toy f/ Kid","USD 6.63","USD 5.04","24%","USD","7","USD 0.35","3","null%","https://s.click.aliexpress.com/e/_DkNTrsF"
"1005002878064036","https://ae04.alicdn.com/kf/H22de7bd0451f4748870c696adad95b34X.jpg","http://cloud.video.taobao.com/play/u/2675628091/p/1/e/6/t/1/315744353049.mp4","DIY Assemble Chameleon Robot Electronic Toys,Competitive Crawl Chameleon Interactive Game For Children Educational Toys","USD 9.80","USD 4.90","50%","USD","7","USD 0.34","5","100.0%","https://s.click.aliexpress.com/e/_DkQBRNV"
"4000817149763","https://ae04.alicdn.com/kf/H7f2cade5835c406b8d4234b736067db29.jpg","http://cloud.video.taobao.com/play/u/2675628091/p/1/e/6/t/1/256651710327.mp4","Untamed Dinosaur T-Rex Interactive Collectible Dinosaur Toys Finger Funny Gifts Kids Childes","USD 35.00","USD 17.85","49%","USD","7","USD 1.25","10","65.0%","https://s.click.aliexpress.com/e/_DlmI3l9"
"1005004609898469","https://ae04.alicdn.com/kf/S37aaddbdae53491b9fef21de671742116.jpg",,"Electric Educational Track Toys Children Piggy Climbing Stairs Slides Track Toys with Music Lights For Kids Aged 3+","USD 0.62","USD 0.37","40%","USD","7","USD 0.03","1","100.0%","https://s.click.aliexpress.com/e/_DdNE4oR"
"1005003601878422","https://ae04.alicdn.com/kf/Hd800fbd668694b939a59cb84a3db8aedT.jpg",,"Creative Original Inductive Electric Robot Car Line Follower Magic Pen Toy Follow Any Line You Draw Xmas Gifts Educational Toy","USD 11.53","USD 5.19","55%","USD","7","USD 0.36","4","100.0%","https://s.click.aliexpress.com/e/_DnKmeUn"
"1005003723942089","https://ae04.alicdn.com/kf/S49a272b1cd7c4179b3e74065bb9278e9U.jpg",,"Electronic Memory Game Handheld Toy Classic Maze Puzzle Challenge Educational Brain Training Toy Interactive Games For Kids Ages","USD 2.50","USD 1.75","30%","USD","7","USD 0.12","0","null%","https://s.click.aliexpress.com/e/_DlMRnZN"
"1005004274899324","https://ae04.alicdn.com/kf/Sc5c7e684c8e24f7196f1140298d9e5c3g.jpg",,"Robot Dancing Dog Robotic Stunt Puppy Built-In LED Lights And Music Electronic Pet Toy With LED Eyes Toddler Interactive","USD 16.33","USD 8.98","45%","USD","7","USD 0.63","0","null%","https://s.click.aliexpress.com/e/_Dk5U6lp"
"1005003212516430","https://ae04.alicdn.com/kf/S66b7da234f99449a8130385a81f53f27z.jpg",,"Christmas Dancing Cactus Electronic Plush Toys Singing Recording Lighting Decoration Gift Funny Early Education Toys For Kids","USD 19.19","USD 13.43","30%","USD","7","USD 0.94","6","100.0%","https://s.click.aliexpress.com/e/_DEv1i63"
"1005003087993784","https://ae04.alicdn.com/kf/Ha071cfa87df84342b96af5501510a3d9b.jpg","http://cloud.video.taobao.com/play/u/2675628091/p/1/e/6/t/1/320913282935.mp4","Dancing Cactus Toy Funny Electric Songs And Luminous Plant Decor Cactu Plush Stuffed with Music Kids Christmas Gifts Home Office","USD 4.83","USD 2.61","46%","USD","8.0","USD 0.21","0","0.0%","https://s.click.aliexpress.com/e/_DCdY6bN"
"1005004727625220","https://ae04.alicdn.com/kf/Aa09415a07f43464c85b8ee896354c480f.jpg","http://cloud.video.taobao.com/play/u/2675628091/p/1/e/6/t/1/1100086525048.mp4","Children's Electric Pet Pig Doll Interactive Toy Cute Animal Dancing Pig Light Music Educational Toys For Child Kids Present","USD 27.88","USD 13.94","50%","USD","10.0","USD 1.39","0","null%","https://s.click.aliexpress.com/e/_DDF4T99"
"1005004674475728","https://ae04.alicdn.com/kf/S93267c1982f3451e8d0a3f50b099a0aat.jpg","http://cloud.video.taobao.com/play/u/2675628091/p/1/e/6/t/1/1100083182540.mp4","Crawling Crab Baby Toys with Music LED Light Up Musical Toys for Toddler Automatically Avoid Obstacles Interactive Toys for Kids","USD 7.39","USD 4.88","34%","USD","7","USD 0.34","0","null%","https://s.click.aliexpress.com/e/_DCyw3bv"
"1005002858514087","https://ae04.alicdn.com/kf/Hc82496c6d08f48de8e72f3f093c4142cC.jpg","http://cloud.video.taobao.com/play/u/2675628091/p/1/e/6/t/1/315616206425.mp4","Kawaii Dancing cactus talking cactus Stuffed Plush Toy Electronic toy with song plush cactus potted toy Early Education Toy kids","USD 4.41","USD 2.65","40%","USD","7","USD 0.19","0","null%","https://s.click.aliexpress.com/e/_DcxDn5H"
"1005003325224298","https://ae04.alicdn.com/kf/H305cdb3ab13842819c0b9333e60b16f3d.jpg",,"Console Retro Mini Game Machine Children's Handheld Game Console Retro Mini Game Player For Kids Adults Players Electronic Toys","USD 2.06","USD 1.44","30%","USD","7","USD 0.10","0","null%","https://s.click.aliexpress.com/e/_DlSaEMf"
"1005004290328034","https://ae04.alicdn.com/kf/S651464ff234d4700bf4c3b6bf61d5432C.jpg","http://cloud.video.taobao.com/play/u/2675628091/p/1/e/6/t/1/1100034048318.mp4","Electric Induction Snake Toy Cat Toy Animal Trick Terrifying Mischief Kids Toys Funny Novelty Gift Girls Toys Electronic Games","USD 9.11","USD 5.19","43%","USD","7","USD 0.36","0","null%","https://s.click.aliexpress.com/e/_DknxQe7"
"1005004200126341","https://ae04.alicdn.com/kf/S19f395693852443ab3a5aca0456c9fe32.jpg","http://cloud.video.taobao.com/play/u/2675628091/p/1/e/6/t/1/1100016074391.mp4","electronic pets walking animal toys Induction Magnetic Chick Duck Owl Games Electric Toys children's toys girl Gifts for kids","USD 21.23","USD 8.49","60%","USD","7","USD 0.59","1","null%","https://s.click.aliexpress.com/e/_DBfp8kf"
"1005004716444992","https://ae04.alicdn.com/kf/S1970dc80c4db43bd8b17a4048248382dt.jpg",,"Movable Electronic Dinosaur Toys W/ Lights Roar Sound Walking Dinosaur Figure Flying Dragon Educational Toys Girls Boys Kids","USD 9.81","USD 5.98","39%","USD","7","USD 0.42","0","null%","https://s.click.aliexpress.com/e/_DEu42b9"
"1005003657440175","https://ae04.alicdn.com/kf/Hc99debbc29ba4842ae4486f3e2e16a626.jpg",,"Walking Dog Toy Musical Plush Toys Dog Toys For Kids Electronic Interactive Companion Sing Stuffed Animal Built In 60 Musics","USD 23.95","USD 16.76","30%","USD","7","USD 1.17","0","null%","https://s.click.aliexpress.com/e/_Dld6dKn"
"1005003565076911","https://ae04.alicdn.com/kf/H06ecac24397347619d90f1463238b9139.jpg","http://cloud.video.taobao.com/play/u/2675628091/p/1/e/6/t/1/337395190653.mp4","Robot Rabbit Toy Electronic Plush Bunny Walking Jumping Cute Pet Running Shake Ears Electric Animal Toys For Kids Baby Gifts","USD 19.50","USD 9.75","50%","USD","8.0","USD 0.78","9","100.0%","https://s.click.aliexpress.com/e/_DdjqEa7"
"1005004658758655","https://ae04.alicdn.com/kf/Sd17f3241194c4a82a22d0e8097038b26E.jpg",,"Mini portable console Handheld Keychain Arcade Game Console  Built-in 26 Games Mini Video Gaming Player Puzzle Kids Toys","USD 1.06","USD 0.83","22%","USD","7","USD 0.06","0","null%","https://s.click.aliexpress.com/e/_DllZkWb"
"1005002233232462","https://ae04.alicdn.com/kf/Ha36dd92355d84fd2936729ed707eb7383.jpg","http://cloud.video.taobao.com/play/u/2675628091/p/1/e/6/t/1/299957654793.mp4","Candy Gun Sugar Lollipop Gun Sweet Toys for Girlfriends Light Toy lollipop storage Toy for Children Adult I Love You","USD 2.90","USD 1.59","45%","USD","7","USD 0.11","1","0.0%","https://s.click.aliexpress.com/e/_DDKcHNH"
"1005003782492956","https://ae04.alicdn.com/kf/H7ba8bea5c1a548bab222c687a09b5a34x.jpg","http://cloud.video.taobao.com/play/u/2675628091/p/1/e/6/t/1/344860818126.mp4","Simulation robot dog electronic pet sound control teddy walking nodding music touch control robot animal pet children toy gift","USD 28.70","USD 17.22","40%","USD","7","USD 1.21","5","null%","https://s.click.aliexpress.com/e/_DlYhARz"
"1005003584817987","https://ae04.alicdn.com/kf/H94a008db732641dda12f3226b1a69520A.jpg","http://cloud.video.taobao.com/play/u/2675628091/p/1/e/6/t/1/338387443674.mp4","Robot Horse Toy Leash Controled Electronic Horse Plush Interactive Animal Pet Walk Dance Music Toys For Children Birthday Gifts","USD 25.85","USD 20.42","21%","USD","7","USD 1.43","12","96.0%","https://s.click.aliexpress.com/e/_DkrtSCn"
"1005002875754372","https://ae04.alicdn.com/kf/H19c93f8a73dc4a7aa3551fbdbf574435U.jpg",,"Dinosaur Electronic Robot Roaring Tyrannosaurus Rex Toys Children Dinosaur Toys Interactive Education Learning Dinosaur Gifts","USD 13.11","USD 10.49","20%","USD","7","USD 0.73","0","null%","https://s.click.aliexpress.com/e/_DE0244r"
"4000210652773","https://ae04.alicdn.com/kf/Hf4fd30374d1e4159938f707f40b0704dO.jpg",,"2pcs Children Walkie Talkies with LED Light Long Distance Handheld Wireless Call Electronic 2 Way Radio Kids Educational Toys","USD 8.50","USD 5.78","32%","USD","7","USD 0.40","0","null%","https://s.click.aliexpress.com/e/_Dk7YB6J"
"1005004515501248","https://ae04.alicdn.com/kf/S6da18d85b0c440278573f37d2d91bad2m.jpg","http://cloud.video.taobao.com/play/u/2675628091/p/1/e/6/t/1/1100064432937.mp4","1PCS Funny Macaron Capsules Electronic Pets Tamagotchi 90S Nostalgic 49 Pets In One Virtual Cyber Digital Pet  Pixel Toys","USD 2.69","USD 2.13","21%","USD","7","USD 0.15","0","null%","https://s.click.aliexpress.com/e/_DC3FHFv"
"1005004042584329","https://ae04.alicdn.com/kf/Sd0bbdd8b46c74f839e31daa3437d72a9P.jpg",,"2pcs Wireless Walkie Talkie Toys For Children Electronic Toys Portable Long Distance Reception Toys 200-300M Kid's Gift","USD 16.95","USD 9.66","43%","USD","7","USD 0.68","2","80.0%","https://s.click.aliexpress.com/e/_DEO1YSL"
"1005003050902054","https://ae04.alicdn.com/kf/He862b32e974c482f852f7f6ebbdd4917o.jpg",,"Electronic Talking Repeating Parrot Singing Chirping Bird With Motion Sensor Activation Pronunciation Kids Electric Animal Toy","USD 14.53","USD 7.99","45%","USD","7","USD 0.56","13","96.0%","https://s.click.aliexpress.com/e/_Dc8NDAf"
"1005004752091340","https://ae04.alicdn.com/kf/S71a5a23dc79a4f558993670c6c2bb715P.jpg",,"2022 New Electronic Pet Gift Key Ring Dinosaur Egg Pet Toy Gift Christmas Puzzle Funny 90s Nostalgic Virtual Pet Toy","USD 3.82","USD 3.02","21%","USD","7","USD 0.21","0","null%","https://s.click.aliexpress.com/e/_DkZJLux"
"1005002900222895","https://ae04.alicdn.com/kf/S9cb44e0de45e40578b97f003a9f51c17B.jpg","http://cloud.video.taobao.com/play/u/2675628091/p/1/e/6/t/1/316876275300.mp4","Induction Escape Crab Children toys Musical/Crawling Electronic toy for boys&girls interactive toys for kids juguetes para niños","USD 27.11","USD 16.27","40%","USD","7","USD 1.14","19","100.0%","https://s.click.aliexpress.com/e/_DefDIND"
"1005004358915771","https://ae04.alicdn.com/kf/Ab5195863003a411d9f7fb3f5cb7394d0A.jpg","http://cloud.video.taobao.com/play/u/2675628091/p/1/e/6/t/1/1100041415485.mp4","Original Lollipets Mini Cute Animal Electronic Interactive Pets Collectible Figurines Pets Girl Birthday Gift Children's Toys","USD 33.00","USD 18.15","45%","USD","8.0","USD 1.45","2","100.0%","https://s.click.aliexpress.com/e/_DEEGYEb"
"1005004651233994","https://ae04.alicdn.com/kf/S189c36eba6e84851adbc09e76e62be3fE.jpg","http://cloud.video.taobao.com/play/u/2675628091/p/1/e/6/t/1/1100081047076.mp4","New Electric Dancing Pet Pig Toys With Swing Light Music Little Cute Pig Animal Toys For Baby Birthday Xmas Gift Wholesale","USD 19.15","USD 9.77","49%","USD","10.0","USD 0.98","0","null%","https://s.click.aliexpress.com/e/_DdCvA8r"
