"ProductId","Image Url","Video Url","Product Desc","Origin Price","Discount Price","Discount","Currency","Commission Rate","Commission","Sales180Day","Positive Feedback","Promotion Url"
"1005004724089392","https://ae04.alicdn.com/kf/S6e5a36e828834232926e61ff50e25e67m.jpg","http://cloud.video.taobao.com/play/u/2675628091/p/1/e/6/t/1/1100086307644.mp4","Crawling Crab Baby Toy with Music and LED Light Up for Kids Toddler Interactive Toy with Automatically Avoid Obstacles Build","USD 8.04","USD 4.82","40%","USD","7","USD 0.34","0","null%","https://s.click.aliexpress.com/e/_DB00QL9"
"1005004729262278","https://ae04.alicdn.com/kf/S3e4ce401971e4a159f9708dee926496ce.jpg",,"Small Ducks Climbing Toys Electric Ducks Chasing Race Track Game Set Duck Race Track Toy With Flashing Lights And Music","USD 9.34","USD 3.55","62%","USD","7","USD 0.25","0","null%","https://s.click.aliexpress.com/e/_Dkr55zl"
"1005002744158888","https://ae04.alicdn.com/kf/H3f736dd7d92b4a79b98fe9790cda626ba.jpg","http://cloud.video.taobao.com/play/u/2675628091/p/1/e/6/t/1/346552007111.mp4","Interactive Swing Cactus Plush Toys, Electronic Shake Dancing Cactus Funny Plush Toys for Home Window Decoration","USD 7.68","USD 4.38","43%","USD","8.0","USD 0.35","0","null%","https://s.click.aliexpress.com/e/_DD7Ihin"
"1005003238731953","https://ae04.alicdn.com/kf/H00192bda83eb486ca7005202ba5590beT.jpg","http://cloud.video.taobao.com/play/u/2675628091/p/1/e/6/t/1/325130953081.mp4","Electric Shaking Head Donkey Can Sing and Dance Little Donkey Crazy Funny Swing Boy and Girl Children Toy Gift Electronic Pets","USD 36.60","USD 24.16","34%","USD","15.0","USD 3.62","3","100.0%","https://s.click.aliexpress.com/e/_DlLoTJ1"
"32963387898","https://ae04.alicdn.com/kf/HTB1nSaRaffsK1RjSszgq6yXzpXar.jpg","http://cloud.video.taobao.com/play/u/2675628091/p/1/e/6/t/1/215713485710.mp4","5 Colors Electric Walking Unicorn Plush Toy Stuffed Animal Dolls 35cm Electronic Music Unicorn Toy for Children Christmas Gifts","USD 8.70","USD 8.70","0%","USD","7","USD 0.61","1","0.0%","https://s.click.aliexpress.com/e/_Dezygrl"
"1005004478284379","https://ae04.alicdn.com/kf/Sae8ca7da64d541adabc734050a00603eu.jpg",,"1PCs 90S Nostalgic Tamagotchi Electronic Pets Gift Keyring Educational Funny Virtual Cyber Pet Toy Gift Christmas Pets Toys","USD 4.50","USD 2.56","43%","USD","7","USD 0.18","9","100.0%","https://s.click.aliexpress.com/e/_DD33ouX"
"1005004213495827","https://ae04.alicdn.com/kf/S0dceae0b93924965be119599fc93e2d0X.jpg",,"Hen Laying Eggs Plush Chicken Stuffed Toy Electronic Plush Toy Dancing Singing Anti-Stress Gadget Funny Christmas Gift for Kids","USD 21.04","USD 14.73","30%","USD","7","USD 1.03","3","100.0%","https://s.click.aliexpress.com/e/_DBJotrZ"
"1005004752534514","https://ae04.alicdn.com/kf/S7d1c9927c12c4b9689dff4648d226f8c4.jpg","http://cloud.video.taobao.com/play/u/2675628091/p/1/e/6/t/1/1100088134565.mp4","Creative Magical Tumbler Unicycle Robot Electric Toy Tightrope Walker Balance Car Assembling Interesting Gifts for Boys Girls","USD 12.92","USD 9.04","30%","USD","7","USD 0.63","1","null%","https://s.click.aliexpress.com/e/_DFOZcpD"
"1005001775471129","https://ae04.alicdn.com/kf/H7fb26acd5b73485fa50e4cd3bb99a47ep.jpg",,"2021 New Russian Music Alphabet Talking Poster Russia kids Education toys Electronic ABC","USD 3.39","USD 2.58","24%","USD","7","USD 0.18","0","0.0%","https://s.click.aliexpress.com/e/_De1W747"
"1005003616154564","https://ae04.alicdn.com/kf/H20d4f50ffde94708a816440ec86444cfX.jpg","http://cloud.video.taobao.com/play/u/2675628091/p/1/e/6/t/1/338971086063.mp4","Electronic Plush Raccoon Toy Walk Robot Animal Electric Procyon Lotor Pet With Music Funny Bear Toys For Children Birthday Gift","USD 32.50","USD 14.62","55%","USD","8.0","USD 1.17","1","null%","https://s.click.aliexpress.com/e/_DdTvuGn"
"4000416234373","https://ae04.alicdn.com/kf/H6630c7ce8d0f472fb68c8de0aebcb324y.jpg",,"High Quality Pets Nostalgic Virtual Pet Cyber Pet Digital Pet Tamagotchi Penguins E-pet Gift Toy Handheld Game Machine","USD 1.47","USD 0.75","49%","USD","7","USD 0.05","3","0.0%","https://s.click.aliexpress.com/e/_Dl5XJgx"
"1005004605072185","https://ae04.alicdn.com/kf/Seef7cd8844114f60a5679ae5f9a1de04c.jpg","http://cloud.video.taobao.com/play/u/2675628091/p/1/e/6/t/1/1100076379037.mp4","Dazzling Music Robot Deer Cattle Electric Toy With Dancing Music Light Animal Figures Early Educational Toys For Baby Xmas Gifts","USD 24.88","USD 12.44","50%","USD","10.0","USD 1.24","0","null%","https://s.click.aliexpress.com/e/_DDwXPTp"
"1005004302968637","https://ae04.alicdn.com/kf/S187a1db108e74293b7f491afc6a455b0A.jpg",,"Climbing Stairs Track Toys Cartoon Duck For Children Electric Duck Track Slide Toys Roller Coaster Toy Boys Girls Birthday Gift","USD 6.77","USD 4.74","30%","USD","7","USD 0.33","0","null%","https://s.click.aliexpress.com/e/_Dn0z7DN"
"32922168066","https://ae04.alicdn.com/kf/HTB1k.lhadfvK1RjSszhq6AcGFXac.jpg",,"1PCS Multi-colors 90S Nostalgic Pets In 1 Virtual Cyber Pet Toy Tomagochi Electronic Pets Keychains Toys","USD 1.60","USD 1.60","0%","USD","7","USD 0.11","12","75.0%","https://s.click.aliexpress.com/e/_Ddbujvd"
"1005004285348146","https://ae04.alicdn.com/kf/S6af671f6aaa74432ab19f957548a0ff4x.jpg",,"Crack Egg Pet Machine Multi-colors Electronic Education Simulation Machine Childhood Nostalgic Toys Kid Toys Gift","USD 3.07","USD 2.12","31%","USD","7","USD 0.15","1","null%","https://s.click.aliexpress.com/e/_DBm9cB5"
"1005002313887930","https://ae04.alicdn.com/kf/H2d0d0dd81aa34782a780e5c509e24365z.jpg",,"1 Pcs Electric Walking Musical Model Flashing Pony  Colorful Flashing Light Kids Interactive Education Toy entertained  Longer","USD 1.69","USD 1.18","30%","USD","8.0","USD 0.09","0","0.0%","https://s.click.aliexpress.com/e/_DBQ7xtl"
"1005002767013183","https://ae04.alicdn.com/kf/H7d2ad033552b4b73ae8296823a3616010.jpg","http://cloud.video.taobao.com/play/u/2675628091/p/1/e/6/t/1/312547232521.mp4","New Laying Eggs Chicken Duck Battery Operated Toy Figure Action Toy with Flashing Lights Electric Universal Musical Baby Toys","USD 10.75","USD 9.67","10%","USD","7","USD 0.68","6","0.0%","https://s.click.aliexpress.com/e/_DFVKYGr"
"1005004464934773","https://ae04.alicdn.com/kf/Sb64ce6e5b51946fa8dacbfe707ba2e13u.jpg",,"Early Learning Electronic Book Language Reading Book Early Educational Activity Book For Toddlers Early Development Toy","USD 26.19","USD 13.09","50%","USD","7","USD 0.92","0","null%","https://s.click.aliexpress.com/e/_Dk7eS0X"
"1005003439405036","https://ae04.alicdn.com/kf/Hbd34cc6fe3df4806a2e9a40e2ab94ab4F.jpg",,"1Pcs Cute Singing Dancing Electronic Pets Ducks Cartoon Swinging Yellow Little Duck Doll Toy LED Light Music Robot Toys","USD 9.99","USD 7.49","25%","USD","7","USD 0.52","0","null%","https://s.click.aliexpress.com/e/_DBIb2fz"
"1005004760345297","https://ae04.alicdn.com/kf/Sdf684b4c393744288c1aa2ea0bbe45b54.jpg",,"Talking Record Cute Parrot Waving Electronic Pet Stuffed Plush Toy Educational Toy For Kids Birthday Gift Boy Girl New C0t8","USD 7.07","USD 2.90","59%","USD","7","USD 0.20","0","null%","https://s.click.aliexpress.com/e/_DmSf5Of"
"1005004769217316","https://ae04.alicdn.com/kf/S7db5d708494f402888e769d15677889fI.jpg",,"Children's Large Fire-breathing Electric Dinosaur Toy Electronic Toys Child Toys For Baby","USD 15.28","USD 12.07","21%","USD","7","USD 0.84","0","null%","https://s.click.aliexpress.com/e/_DcGLGvZ"
"1005004765850739","https://ae04.alicdn.com/kf/S16dc4ba1a1df458080070b60a6d65f41j.jpg",,"Talking Record Cute Parrot Waving Electronic Pet Stuffed Plush Toy Educational Toy For Kids Birthday Gift Boy Girl New R3P7","USD 6.48","USD 3.24","50%","USD","7","USD 0.23","0","null%","https://s.click.aliexpress.com/e/_DdECH4b"
"1005003696138027","https://ae04.alicdn.com/kf/S6a231aa5335e4acabb5539e86b0ecb6fv.jpg","http://cloud.video.taobao.com/play/u/2675628091/p/1/e/6/t/1/342204111147.mp4","Electronic Plush Rabbit Toy Robot Bunny Walking Jumping Running Animal Shake Ears Cute Electric Pet For Kids Birthday Gifts","USD 19.60","USD 8.43","57%","USD","8.0","USD 0.67","5","100.0%","https://s.click.aliexpress.com/e/_DB5OY6T"
"1005003080524281","https://ae04.alicdn.com/kf/H136bfdeae2444aa7adef2694c169849a6.jpg","http://cloud.video.taobao.com/play/u/2675628091/p/1/e/6/t/1/320308173062.mp4","Baby Toys Musical Crawl Snail Kids Toddler Car Toy Vehicles","USD 4.44","USD 2.89","35%","USD","7","USD 0.20","1","null%","https://s.click.aliexpress.com/e/_DBqalGj"
"1005004359902372","https://ae04.alicdn.com/kf/U83b3814d0631427f92a60f7ec3506649p.jpg",,"Toy my lillte horse may Little Pony 2","USD 23.19","USD 22.03","5%","USD","7","USD 1.54","0","null%","https://s.click.aliexpress.com/e/_DBzOGh1"
"1005004662146328","https://ae04.alicdn.com/kf/Aab9d9d59725141c6b144ea126a3c12ea7.jpg",,"Christmas Dancing Cactus Repeat Talking Toy Birthday Present Electronic Push Toy Kids Gift Soft Plush Doll Can Sing And Dance","USD 32.25","USD 12.90","60%","USD","7","USD 0.90","1","null%","https://s.click.aliexpress.com/e/_DBGjgDt"
"4000848370556","https://ae04.alicdn.com/kf/H955ab116b993494d966039d3f8f10975K.jpg","http://cloud.video.taobao.com/play/u/2675628091/p/1/e/6/t/1/1100081993088.mp4","Cute Tamagotchis Electronic Pets Toys 90S Nostalgic 49 in One Virtual Cyber 7 Styles Tamagochi Funny Juguetes Gift","USD 2.53","USD 2.13","16%","USD","7","USD 0.15","305","78.3%","https://s.click.aliexpress.com/e/_DEXbuJV"
"4000857156594","https://ae04.alicdn.com/kf/S549bb935c56f43faab38c308603c4795Q.jpg","http://cloud.video.taobao.com/play/u/2675628091/p/1/e/6/t/1/1100004391307.mp4","Electronic Fish Swim Toy Battery Included Robotic Pet for Kids Bath Toy Fishing Tank Decorating Act Like Real Fish Dropshipping","USD 2.86","USD 2.72","5%","USD","26.0","USD 0.71","15","20.0%","https://s.click.aliexpress.com/e/_DemVYsX"
"1005004573207453","https://ae04.alicdn.com/kf/Sa0f5a6addc4e4d14ad3f85b9444466edB.jpg",,"DIY Rail Racing Small Duck Climbing Stairs Toy Electronic Pig Penguin Music Slide Track Coaster for Kids Educational Toys Gifts","USD 16.83","USD 12.62","25%","USD","7","USD 0.88","1","null%","https://s.click.aliexpress.com/e/_DCG5GT9"
"1005004373976381","https://ae04.alicdn.com/kf/S46bf803db34a47aaae867420fbac30d9W.jpg","http://cloud.video.taobao.com/play/u/2675628091/p/1/e/6/t/1/1100029616001.mp4","Electronic Pet Tamagotchipet Original Kid Digital HD Color Screen 8 E-Pet In One Virtual Cyber Pet Interactive Kid Puzzle Toy","USD 48.66","USD 24.33","50%","USD","8.0","USD 1.95","6","0.0%","https://s.click.aliexpress.com/e/_DCIe05Z"
"1005004496330379","https://ae04.alicdn.com/kf/S6d8f51bc48824287b7a473099208c6837.jpg","http://cloud.video.taobao.com/play/u/2675628091/p/1/e/6/t/1/1100061574755.mp4","Dancing Christmas Tree Repeat Talking Toy Electronic Plush Toys Can Sing Record Lighten  Early Education Funny Gift Christmas Pr","USD 30.05","USD 15.02","50%","USD","10.0","USD 1.50","4","null%","https://s.click.aliexpress.com/e/_DkDClsL"
"1005001875906884","https://ae04.alicdn.com/kf/U0228f03f287b43c0a7371f3028ae570e0.jpg",,"Interactive Toy ""Ferby""","USD 24.94","USD 24.94","0%","USD","8.0","USD 2.00","1","100.0%","https://s.click.aliexpress.com/e/_DCYX1qn"
"4000629070646","https://ae04.alicdn.com/kf/H50ab0e61400a4d45952ce4801886351dY.jpg","http://cloud.video.taobao.com/play/u/2675628091/p/1/e/6/t/1/251123413754.mp4","Drawn Line Magic Pet Toy Robot Pen Inductive Animal Penguin Follow Black Track Map Auto Selfie Run Cute Electric Gift For Kid","USD 12.84","USD 8.99","30%","USD","7","USD 0.63","5","100.0%","https://s.click.aliexpress.com/e/_Dl5aCNZ"
"1005003548280062","https://ae04.alicdn.com/kf/H95cde938bff34b5db63ab8a4ec8b4fa3g.jpg",,"Electric Dinosaur Toy Mechanical Crawling Boys Lighting Sound Effect  Simulation Model Early Education Holiday Gifts Juguete","USD 6.25","USD 3.87","38%","USD","7","USD 0.27","0","null%","https://s.click.aliexpress.com/e/_DB2zj3p"
"1005003930094659","https://ae04.alicdn.com/kf/S076227de4af24674893d1a1d68b230eaK.jpg","http://cloud.video.taobao.com/play/u/2675628091/p/1/e/6/t/1/348300221763.mp4","Electric Toy Pull String Snail Car Light Musical Pet Cartoon Snail Toy For Children Baby Crawl Pull Toy Educational Toys For Kid","USD 24.25","USD 11.40","53%","USD","7","USD 0.80","4","80.0%","https://s.click.aliexpress.com/e/_DkgUG5D"
"1005003675866527","https://ae04.alicdn.com/kf/Sa751f772ee63447e9c77d5f8a329d382k.jpg","http://cloud.video.taobao.com/play/u/2675628091/p/1/e/6/t/1/340749877334.mp4","Tamagochi Electronic Interactive Toys for Kids Little Live Pets Tomagochi 90s Aesthetic Robot Dog Toys for Cats Musical Toy","USD 7.47","USD 7.47","0%","USD","7","USD 0.52","25","82.0%","https://s.click.aliexpress.com/e/_Dnk6vLh"
"1005004226199294","https://ae04.alicdn.com/kf/Se455e7aa485d4a0f881b359e16a691d6L.jpg",,"1PCs Heart-shape Electronic Pets Machine 90S Nostalgic 168 In One Virtual Cyber Toy Robot Dog Classic Handheld Game Console","USD 1.84","USD 1.29","30%","USD","7","USD 0.09","1","100.0%","https://s.click.aliexpress.com/e/_Dkfr38T"
"32853602479","https://ae04.alicdn.com/kf/HTB1B2hhX3aTBuNjSszfq6xgfpXaD.jpg","http://cloud.video.taobao.com/play/u/2675628091/p/1/e/6/t/1/321238415701.mp4","Baby Toys Infant 3D lighting sunflowers Electric Toy with Music & Light Learning Toys for Children Xmas Gifts","USD 19.20","USD 16.70","13%","USD","9.0","USD 1.50","1","100.0%","https://s.click.aliexpress.com/e/_Dd6dAeF"
"1005004358463956","https://ae04.alicdn.com/kf/S9575bc09cc1d45349bbf86c8ad8844f4V.jpg",,"Induction Crawling Crab Electric Pet Musical Toys Children's Toys Birthday Gifts Learn To Climb Toys Interactive Toys","USD 10.59","USD 7.41","30%","USD","7","USD 0.52","2","null%","https://s.click.aliexpress.com/e/_DdmtWPz"
"1005003790494584","https://ae04.alicdn.com/kf/Sdbaed25b96bf40509dd378dda407533a7.jpg","http://cloud.video.taobao.com/play/u/2675628091/p/1/e/6/t/1/344137328415.mp4","Trick Electronic Insect Robot Prank Animal Toys RC Simulation Scorpion Beetle Remote Control Smart Model Child Adult Gift","USD 25.00","USD 15.00","40%","USD","8.0","USD 1.20","1","null%","https://s.click.aliexpress.com/e/_DDHcRV9"
"1005003650799283","https://ae04.alicdn.com/kf/H73b7174565194b39b4707e451825587dD.jpg","http://cloud.video.taobao.com/play/u/2675628091/p/1/e/6/t/1/340265298759.mp4","Interactive Robot Dog Toy Electronic Plush Puppy Sound Control Golden Retriever Walking Music Sheepdog Touch Control Animal Pet","USD 39.50","USD 19.75","50%","USD","8.0","USD 1.58","3","100.0%","https://s.click.aliexpress.com/e/_DFpBJC7"
"1005002611837959","https://ae04.alicdn.com/kf/He7a3326962f14e82922e69335385e5336.jpg",,"Babies Toy Electronic Mobile Phone Touch Screen Early Education Musical Toy","USD 2.98","USD 1.55","48%","USD","7","USD 0.11","0","null%","https://s.click.aliexpress.com/e/_DkJqKur"
"1005004732859827","https://ae04.alicdn.com/kf/Sfb31aa392fea40b5a1f18b8ec556147eK.jpg",,"Automatic Card Early Education Machine 224 Audiobook Cards Audible Talking Flash Cards Electronic Learning toys Tang Poetry","USD 6.48","USD 3.95","39%","USD","7","USD 0.28","0","null%","https://s.click.aliexpress.com/e/_DlCe8YP"
"4001227434555","https://ae04.alicdn.com/kf/Hb2ef9069eea447698fb8cf6232b6cae4U.jpg",,"Hamster Ball Electric Toy Plush Hamster Electric Toys Scroll Walk Little Toy Animal for Children Gift Electronic Pets Toy","USD 12.58","USD 10.32","18%","USD","8.0","USD 0.83","6","0.0%","https://s.click.aliexpress.com/e/_DeMcXsb"
"4000505092395","https://ae04.alicdn.com/kf/Hc9fca230958e405d872524736da41b1cp.jpg",,"Electric Shock Wand Spoof Electric Toy Joke Prank Trick Gift Whole Toy Gift","USD 2.40","USD 1.44","40%","USD","8.0","USD 0.12","45","80.0%","https://s.click.aliexpress.com/e/_DCXKKAT"
"1005004557334659","https://ae04.alicdn.com/kf/Hc92f6dfedfad446d8f4d708403d0e29aB.jpg",,"Talking Record Cute Parrot Waving Wings Electronic Pet  Stuffed Plush Toy Educational Toy for Kids Birthday Gift Boy Girl New","USD 4.91","USD 3.44","30%","USD","7","USD 0.24","4","null%","https://s.click.aliexpress.com/e/_De6ivCF"
"1005004766194999","https://ae04.alicdn.com/kf/S94630435588b4211a03cd369eda610478.jpg",,"Electronic Nostalgic Virtual Network Digital Pet Machine Macaron Color Capsule Egg Ball Model Virtual Pixel Funny Toy Children","USD 3.63","USD 2.87","21%","USD","7","USD 0.20","0","null%","https://s.click.aliexpress.com/e/_DBgOiiL"
"1005003389005021","https://ae04.alicdn.com/kf/H28c4f1d2a0724a4184278b808e832f7c1.jpg","http://cloud.video.taobao.com/play/u/2675628091/p/1/e/6/t/1/328750775386.mp4","Tamagotchis Electronic Pet Electronic Pets Toys 90S Nostalgic 49 Pets In One Virtual Cyber Pet Toy  For Children Gift","USD 2.36","USD 1.86","21%","USD","7","USD 0.13","0","null%","https://s.click.aliexpress.com/e/_DBQXfoF"
"1005004770404849","https://ae04.alicdn.com/kf/S70ae7eb7e6644029b4747b451d75a51bY.jpg",,"Protective Watch Band Wrist Band Fit for Pix Virtual Pet Machine Toy","USD 2.07","USD 1.24","40%","USD","7","USD 0.09","0","null%","https://s.click.aliexpress.com/e/_DkDkt1N"
"1005004274592752","https://ae04.alicdn.com/kf/S74740fd1fe15436398005abc92cc3017O.jpg",,"Dancing Dog Interactive & Smart Dancing Robots for Kids Battery-Operated Electronic Robot Dog with LED Eyes Dancing Robot Toy","USD 10.93","USD 7.65","30%","USD","7","USD 0.54","0","null%","https://s.click.aliexpress.com/e/_Dd5Fldl"
"1005004728284009","https://ae04.alicdn.com/kf/S395c137b6fad4c8b9e7861bcfce4597ai.jpg",,"Electronic Digital Pet Game Console 90S Nostalgic Virtual E-pet Interactive Toys Children Birthday Holiday Gift","USD 1.56","USD 0.70","55%","USD","7","USD 0.05","2","null%","https://s.click.aliexpress.com/e/_DBY0BX1"
"4000481634782","https://ae04.alicdn.com/kf/H852f9fec73d94fb982f78fd9fab51fbb7.jpg","http://cloud.video.taobao.com/play/u/2675628091/p/1/e/6/t/1/247797021998.mp4","15cm Electronic Pets Furbiness Boom Talking Phoebe Interactive Pets Owl Electronic Recording Children Christmas Gift Toys","USD 19.25","USD 13.47","30%","USD","7","USD 0.94","15","100.0%","https://s.click.aliexpress.com/e/_DeapTHH"
"4001156658577","https://ae04.alicdn.com/kf/H206dd1eae2004461b1b68d24c61fbad9o.jpg",,"TALKING PARROT - Repeats What You Say Electronic Pet Plush Interactive Toy","USD 9.13","USD 5.66","38%","USD","7","USD 0.40","2","100.0%","https://s.click.aliexpress.com/e/_DmS7D59"
"1005003449949584","https://ae04.alicdn.com/kf/Sa1a03ed00a3e4847b13d06aba8b5807eV.jpg",,"Toy interactive abtoys макаронка koala purple, walks, sound and music effects pt-01570 Toys for children  Gift for a girl on March 8 for a baby boy on 23 February","USD 28.97","USD 28.97","0%","USD","7","USD 2.03","0","null%","https://s.click.aliexpress.com/e/_Dm0wNTh"
"1005004690207165","https://ae04.alicdn.com/kf/Scc7e6f1ddb4e4a78a1e64689bf78676aJ.jpg",,"Voice Control Crab Toys Cartoon Projection Musical Simulated Crawling Toys for Kids Children Christmas Gifts","USD 8.05","USD 4.02","50%","USD","7","USD 0.28","1","null%","https://s.click.aliexpress.com/e/_DdwbSMJ"
"1005004688317378","https://ae04.alicdn.com/kf/A2875e745336f4058a78752bf79f1d9eeI.jpg",,"Dancing Cactus Repeat Talking Toy Electronic Plush Toys Can Sing Record Lighten Battery USB Charging Early Education Funny Gift","USD 21.48","USD 10.32","52%","USD","7","USD 0.72","1","null%","https://s.click.aliexpress.com/e/_DehUP7t"
"1005004095597483","https://ae04.alicdn.com/kf/Sba9198e95afb4211809b4d58dcffcb8c0.jpg","http://cloud.video.taobao.com/play/u/2675628091/p/1/e/6/t/1/1100006172222.mp4","Electric Tumbling Monkey Animal Funny Toy Voice-activated Induction Light Music Educational Electric Toy","USD 4.65","USD 1.72","63%","USD","7","USD 0.12","0","null%","https://s.click.aliexpress.com/e/_DFsLaIF"
"1005004382727542","https://ae04.alicdn.com/kf/S3c4a64f162ff45e59e09c2a90fdf1279X.jpg",,"Simulation Automatic Obstacle Avoidance Crab Toy Electric Induction Crab Toy Cartoon Light Music Charging Crab Run Toy For Kids","USD 27.33","USD 15.03","45%","USD","7","USD 1.05","0","null%","https://s.click.aliexpress.com/e/_DeajDaB"
"1005004739952330","https://ae04.alicdn.com/kf/S0d74a1b33d85471797aa20e6f4ed6b4dc.jpg",,"Electronic Plush Cats Toy Cute Simulation Cat Plush Toys Soft Stuffed Kitten Model For Kids Girls Birthday Valentine's Day T3S0","USD 7.29","USD 3.64","50%","USD","7","USD 0.25","0","null%","https://s.click.aliexpress.com/e/_DmX8cCR"
"1005004235894944","https://ae04.alicdn.com/kf/Se4a0d85e5e8f463cb61e7778b208cabd3.jpg",,"Flash Swimming Electronic Pet Fish Bath Toys for Children Kids Bathtub Battery Powered Swim Robotic for Fishing Tank Decoration","USD 3.82","USD 3.25","15%","USD","8.0","USD 0.26","9","100.0%","https://s.click.aliexpress.com/e/_DeZVi0P"
"32740468648","https://ae04.alicdn.com/kf/HTB1YgxfkJnJ8KJjSszdq6yxuFXag.jpg","http://cloud.video.taobao.com/play/u/2675628091/p/1/e/6/t/1/280812474412.mp4","Children's Educational Toys Electronic Universal Plastic Simulated Bull Models Flashing Sounding Toy Cute Birthday Gifts 2021","USD 15.05","USD 14.30","5%","USD","8.0","USD 1.14","5","100.0%","https://s.click.aliexpress.com/e/_DdRcNoF"
"1005003304757543","https://ae04.alicdn.com/kf/H7a31a308293242d18c52b332af070f57N.jpg",,"YKS 2pcs walkie talkie kids Radio Retevis Handheld Toys for Children Gift Portable Electronic Two-Way Radio communicator kid toy","USD 3.41","USD 2.39","30%","USD","7","USD 0.17","2","20.0%","https://s.click.aliexpress.com/e/_DFzQF9z"
"1005004635155353","https://ae04.alicdn.com/kf/S3d193e7d260244cd89047b0c183b57adK.jpg",,"Electronic Toy Phone Kid Mobile Phone Cellphone Telephone Educational Learning Toys Music Baby Infant Phone Best Gift For Kid","USD 3.31","USD 1.82","45%","USD","7","USD 0.13","0","null%","https://s.click.aliexpress.com/e/_DdbroAj"
"1005004129055043","https://ae04.alicdn.com/kf/Sb846914c70be4321bf5c0911be360f4fv.jpg","http://cloud.video.taobao.com/play/u/2675628091/p/1/e/6/t/1/1100008008318.mp4","Hot ! Random Color Toys Electronic Pets Toys 90S Nostalgic 49 Pets in One Virtual Cyber Toy Funny Pet Gift Play Toy","USD 2.60","USD 1.77","32%","USD","7","USD 0.12","10","100.0%","https://s.click.aliexpress.com/e/_DErgbzl"
"1005004406149875","https://ae04.alicdn.com/kf/S30a5abfaa59842aab711a9c07d277102Q.jpg","http://cloud.video.taobao.com/play/u/2675628091/p/1/e/6/t/1/1100049784070.mp4","Cartoon Musical Electric Dancing Duck Toy Kids Children Girl Boy Infant Toddler Waving Dancing toys Children's Day Birthday Gift","USD 27.50","USD 15.95","42%","USD","7","USD 1.12","0","null%","https://s.click.aliexpress.com/e/_DnoRIgf"
"1005003677913966","https://ae04.alicdn.com/kf/Hda329b90b85441b2a3b307d1a79500bfD.jpg","http://cloud.video.taobao.com/play/u/2675628091/p/1/e/6/t/1/341663947157.mp4","electric crawl Soldiers Electric Toy Large Electric Climb Toys With Light And Sound Military Model Toy Will Crawl Soldier","USD 11.52","USD 10.94","5%","USD","8.0","USD 0.88","3","null%","https://s.click.aliexpress.com/e/_DC4sxhV"
"1005004307523688","https://ae04.alicdn.com/kf/Sc290f69326974ac28d6c86c37ebcfdeci.jpg",,"Baby Electric Crab Leash Toy Cute Cartoon Pet Traction Interactive Learn Musical Toys Children Light To Toy Toys Climb Kids Q8j9","USD 3.66","USD 1.87","49%","USD","7","USD 0.13","0","null%","https://s.click.aliexpress.com/e/_DDerHdN"
"1005004235789968","https://ae04.alicdn.com/kf/Sece914f0059744418d7c9ebce568f382P.jpg","http://cloud.video.taobao.com/play/u/2675628091/p/1/e/6/t/1/1100021333379.mp4","Electric Dancing Girl Doll Walking Music Light Children's Cute Styling Funny Kids Early Educational Toy","USD 6.09","USD 4.87","20%","USD","7","USD 0.34","1","null%","https://s.click.aliexpress.com/e/_DlggMkJ"
"1005003401899054","https://ae04.alicdn.com/kf/Hff53b7257e7d4459b3426e40cd706971E.jpg","http://cloud.video.taobao.com/play/u/2675628091/p/1/e/6/t/1/330332924326.mp4","Baby Crawl Toy for 0-2 Year Old Infants 6-12-18 Months Children Puzzle Electric Toddlers Learn To Climb Toys Kid Early Education","USD 2.35","USD 1.88","20%","USD","7","USD 0.13","1","null%","https://s.click.aliexpress.com/e/_DEbteCP"
"1005003762120797","https://ae04.alicdn.com/kf/H77df11f7fabe4d988e81deecbe2d9e5fk.jpg","http://cloud.video.taobao.com/play/u/2675628091/p/1/e/6/t/1/344520563162.mp4","Lovely Repeat Talking Dancing Cactus Doll Electronic Singing Speak Sound Record Repeat Plush Toys Early Educational Toys Gift","USD 16.83","USD 8.42","50%","USD","7","USD 0.59","10","100.0%","https://s.click.aliexpress.com/e/_DCjAdoL"
"4000299520039","https://ae04.alicdn.com/kf/H3db207eb659b4939bae7c1a132bd50e77.jpg","http://cloud.video.taobao.com/play/u/2675628091/p/1/e/6/t/1/240147336919.mp4","Cute Electric Walking Dancing Doll Lighting Music Kid Toy Big Head Boy Gift","USD 6.06","USD 4.55","25%","USD","7","USD 0.32","8","0.0%","https://s.click.aliexpress.com/e/_Dlh3RrD"
"1005003775063930","https://ae04.alicdn.com/kf/Sf2ba9eab648b43f78d97eae9e65cd657G.jpg","http://cloud.video.taobao.com/play/u/2675628091/p/1/e/6/t/1/343505060424.mp4","Electronic Plush Monkey Toy Robot Tiger Wag Tail Electric Cute Golden Monkey Walking Running Animal Pet Kids Birthday Gift","USD 25.50","USD 14.02","45%","USD","8.0","USD 1.12","3","null%","https://s.click.aliexpress.com/e/_DmKe6H1"
"1005004770131115","https://ae04.alicdn.com/kf/S42b435a2b93f4462b2af2819a2b83141L.jpg",,"Tamagotchi Digital Monster Game Machine Retrogame Play Vidio Handheld Gaming Portable Mini Video Greymon Console Electronic Toy","USD 13.58","USD 8.69","36%","USD","7","USD 0.61","0","null%","https://s.click.aliexpress.com/e/_Dm2BTZ9"
"4000062133402","https://ae04.alicdn.com/kf/HTB1qtVZaHr1gK0jSZR0q6zP8XXar.jpg",,"Glowing Deer Animal Toy Music Walking Educational Cute Gift for Children Kids YH-17","USD 8.05","USD 5.96","26%","USD","7","USD 0.42","0","0.0%","https://s.click.aliexpress.com/e/_DCBN1yL"
