"ProductId","Image Url","Video Url","Product Desc","Origin Price","Discount Price","Discount","Currency","Commission Rate","Commission","Sales180Day","Positive Feedback","Promotion Url"
"1005004097125181","https://ae04.alicdn.com/kf/Sf0ce8b984182480f974cd7a618dee73fL.jpg","http://cloud.video.taobao.com/play/u/2675628091/p/1/e/6/t/1/1100004334051.mp4","Baby Mobile Phone Toy Teether Bite Music Phone Voice Buttons Early Education Learning Machine Electronic Bebe Gift Toy 0-2yers","USD 13.67","USD 8.20","40%","USD","7","USD 0.57","1","100.0%","https://s.click.aliexpress.com/e/_DBIYYcr"
"1005003158593229","https://ae04.alicdn.com/kf/S211b2a8cb37e4122bee720d502bb540bM.jpg",,"Peekaboo bear with a handkerchief Interactive ToyS ""Teddy Bear Plays Hide And Seek""  Talking Electronic Musical Educational","USD 23.93","USD 14.36","40%","USD","7","USD 1.01","2","100.0%","https://s.click.aliexpress.com/e/_Dndv4IT"
"1005002780787892","https://ae04.alicdn.com/kf/H205673bf0c1b49fdad02e05d8a915005E.jpg","http://cloud.video.taobao.com/play/u/2675628091/p/1/e/6/t/1/312948296489.mp4","Electric Voice-Activated Bird Simulation Couple Bird Will Move Magpie Parrot Pet Bird Children Decoration Model Toy Gift","USD 25.72","USD 12.86","50%","USD","7","USD 0.90","8","70.0%","https://s.click.aliexpress.com/e/_DDvRAnz"
"1005003657364339","https://ae04.alicdn.com/kf/H8db46bbf40d84595b6831750e69f8cbav.jpg",,"Coding Robot - Mini Inductive Robot Toys  Creative Robot Puzzle Race Game Running Along The Line Drawn By Magic Pen Electronic R","USD 11.56","USD 8.09","30%","USD","7","USD 0.57","0","null%","https://s.click.aliexpress.com/e/_DER7Xwn"
"1005004143272314","https://ae04.alicdn.com/kf/Sf91f0c67351c44b1b51d0872170b0597G.jpg","http://cloud.video.taobao.com/play/u/2675628091/p/1/e/6/t/1/1100009838311.mp4","Electronic Pets House Style 168 Pets In One Virtual Cyber Digital Pet Toy Pixel Funny Play Toy Kids Gift Keychain Pendant Toy","USD 5.32","USD 2.39","55%","USD","7","USD 0.17","8","null%","https://s.click.aliexpress.com/e/_Dknqmht"
"1005004192331362","https://ae04.alicdn.com/kf/S1ac199098c78489aba352c7da32b978eY.jpg",,"Tumbler Dinosaur Egg Multi-colors Virtual Cyber Digital Pet Game Toy Tamagotchis Digital Electronic E-Pet Christmas Gift","USD 1.59","USD 1.26","21%","USD","7","USD 0.09","6","96.0%","https://s.click.aliexpress.com/e/_DDPTD2r"
"1005004442338381","https://ae04.alicdn.com/kf/Sf2ec14032f7d476abb7cb9ef2cd4cc808.jpg",,"Induction Escape Crab Rechargeable Electric Pet Musical Toys Children'S Toys Birthday Gifts Educational Toys Learn To Climb Toys","USD 9.40","USD 9.40","0%","USD","7","USD 0.66","0","null%","https://s.click.aliexpress.com/e/_DF6uwYJ"
"1005004514579729","https://ae04.alicdn.com/kf/Sdded31e8d6e0472aa57eec62570a821dY.jpg","http://cloud.video.taobao.com/play/u/2675628091/p/1/e/6/t/1/1100064335902.mp4","1Pcs Swimming Electronic Fish Robot Fish Bath Toys Robotic Pet Animals Water Fishing Decorating Act Like Real for Kids Gift","USD 14.49","USD 7.24","50%","USD","7","USD 0.51","4","100.0%","https://s.click.aliexpress.com/e/_Dc9cPbD"
"1005004055957465","https://ae04.alicdn.com/kf/Seb2e2bf0aca74f8eaadf4897c3fb1097k.jpg",,"1PC Mini Classic Game Machine Retro Nostalgic Game Console With Keychain Video Game Handheld Game Players Electronic Toys","USD 1.80","USD 1.26","30%","USD","7","USD 0.09","1","100.0%","https://s.click.aliexpress.com/e/_DdOrKI7"
"1005004589771912","https://ae04.alicdn.com/kf/S5584d45239d84862b962dda8a43e0c6cU.jpg","http://cloud.video.taobao.com/play/u/2675628091/p/1/e/6/t/1/1100074502168.mp4","Walking Lizard Model Robotic Toys with Sounds Lights Crawling Removable Tail Funny Animal Electric Toys for Kid Children's Gift","USD 45.72","USD 18.29","60%","USD","8.0","USD 1.46","1","null%","https://s.click.aliexpress.com/e/_De53aij"
"1005002104180848","https://ae04.alicdn.com/kf/Ha3383e1b2b164e2bbb4fd7df535c3af6b.jpg",,"Singing Chirping Bird In Cage Realistic Sounds Movements Liberty Singing And Chirping Bird Toy In Cage Realistic Sounds","USD 9.83","USD 4.91","50%","USD","7","USD 0.34","1","100.0%","https://s.click.aliexpress.com/e/_DeffXgL"
"1005001296411600","https://ae04.alicdn.com/kf/Hce870c3057934310bd97a0d734410346f.jpg","http://cloud.video.taobao.com/play/u/2675628091/p/1/e/6/t/1/299791111723.mp4","Robot Fish Toys Swimming Electronic Fish Bath Toy Robotic Pet Animals Water Toy Fishing Decorating Act Like Real","USD 26.50","USD 10.86","59%","USD","8.0","USD 0.87","18","100.0%","https://s.click.aliexpress.com/e/_DE7QX1H"
"1005004211757725","https://ae04.alicdn.com/kf/Sdf8b13b6bbab40c0a9853237e7cb87b90.jpg","http://cloud.video.taobao.com/play/u/2675628091/p/1/e/6/t/1/1100019366087.mp4","Mini Tumbler Dinosaur Egg Multi-colors Virtual Cyber Digital Pet Game Toy Tamagotchis Digital Electronic E-Pet Cute Gift","USD 1.68","USD 0.84","50%","USD","7","USD 0.06","8","100.0%","https://s.click.aliexpress.com/e/_DEFLzML"
"1005003697104753","https://ae04.alicdn.com/kf/S399cf4ba9fbf49a3aa674765ff129c9aH.jpg",,"1pc Mini Birds Robot Games Interactive Electronics Kids Toys for Children Virtual Electronic Pet Gadgets New Electronics Toys","USD 2.25","USD 1.12","50%","USD","7","USD 0.08","0","null%","https://s.click.aliexpress.com/e/_DEc1QVD"
"1005002978982318","https://ae04.alicdn.com/kf/Hba3bc8c7ffa14bd89633ff2c2393a2e9n.jpg","http://cloud.video.taobao.com/play/u/2675628091/p/1/e/6/t/1/317955969433.mp4","Robot Dog DIY Smart Control Magic Pet Dog Animals Toy Intelligent Voice Multifunctional Touching Sensor Electric","USD 21.86","USD 15.08","31%","USD","7","USD 1.06","6","20.0%","https://s.click.aliexpress.com/e/_Ddqs97h"
"1005004189947162","https://ae04.alicdn.com/kf/S4ce02b2a9bc8485fbeb0a365e99dd806R.jpg","http://cloud.video.taobao.com/play/u/2675628091/p/1/e/6/t/1/1100015030505.mp4","Electric Dancing Swing Zombie Music Lighting Doll Shiny Early Educational Electronic Walking Robot Kids Toy","USD 6.09","USD 4.87","20%","USD","7","USD 0.34","1","null%","https://s.click.aliexpress.com/e/_DnPEjmP"
"1005004309883866","https://ae04.alicdn.com/kf/S0b2f753a6e5f4b0f9fe9d4a2c08e9718c.jpg",,"Baby Electric Crab Leash Toy Cute Cartoon Pet Traction Kids Climb Toy Light Toy Interactive Toys To Children Musical Learn J7C8","USD 2.35","USD 1.29","45%","USD","7","USD 0.09","0","null%","https://s.click.aliexpress.com/e/_DCeHgZD"
"1005004500302210","https://ae04.alicdn.com/kf/S87a12939dbfb438abbe3ebb3e079812eP.jpg","http://cloud.video.taobao.com/play/u/2675628091/p/1/e/6/t/1/1100062120349.mp4","New Electric Jumping Cat toy Shrimp Moving Simulation Lobster Electronic Plush Toys For Pet dog cat Children Stuffed Animal toy","USD 20.72","USD 10.36","50%","USD","8.0","USD 0.83","1","null%","https://s.click.aliexpress.com/e/_Ddh12B9"
"1005001580317326","https://ae04.alicdn.com/kf/He46c8333ac51445a9fc98c171b253fe5y.jpg",,"Kids Toy Water Console Game Machine Children's Classic Intellectual Toys Gifts","USD 9.46","USD 5.20","45%","USD","7","USD 0.36","0","null%","https://s.click.aliexpress.com/e/_DEigmBd"
"1005004616530586","https://ae04.alicdn.com/kf/Sd1d3f010c74a4c948bb883a1f3f6c4cdN.jpg","http://cloud.video.taobao.com/play/u/2675628091/p/1/e/6/t/1/1100077656860.mp4","Dance Robot Electric Pet Musical Shining Toy 6 Claws Octopus Spider Robot Educational Interactive Toys for Children‘sToy Gift","USD 22.19","USD 13.31","40%","USD","10.0","USD 1.33","2","100.0%","https://s.click.aliexpress.com/e/_DDcSzEP"
"1005002655582841","https://ae04.alicdn.com/kf/H779e7b2ad9454a9ab698d91ca0fc5aa5O.jpg","http://cloud.video.taobao.com/play/u/2675628091/p/1/e/6/t/1/310617062057.mp4","2022 New Mini Electronic Pets Toys 8 Pets in 1 Virtual Cyber USB Charging Micro Chat Pet Toy for Kids Adults Gift","USD 18.82","USD 16.19","14%","USD","7","USD 1.13","8","100.0%","https://s.click.aliexpress.com/e/_Dlxihyb"
"1005004182173175","https://ae04.alicdn.com/kf/S006ee1b3b7fa4e4dbb746a785c0b6a3au.jpg","http://cloud.video.taobao.com/play/u/2675628091/p/1/e/6/t/1/1100014301524.mp4","New Tamagot Electronic Pets Gift Keyring Pets Toys Educational Funny 90S Nostalgic Virtual Cyber Pet Toy Game For Kids Gift","USD 1.52","USD 1.06","30%","USD","7","USD 0.07","10","80.0%","https://s.click.aliexpress.com/e/_DEFzSW7"
"4000302733189","https://ae04.alicdn.com/kf/H1ecc82f7e48e4498a0bfba655950b3d6F.jpg","http://cloud.video.taobao.com/play/u/2675628091/p/1/e/6/t/1/240571410937.mp4","Dancing Electric Rabbit Doll Children's Educational Walking Robot The Shelf Toys Kids Gift","USD 6.07","USD 4.55","25%","USD","7","USD 0.32","11","100.0%","https://s.click.aliexpress.com/e/_DeSGlxp"
"1005004477640529","https://ae04.alicdn.com/kf/S52cbd5f3585a4f5b843be90e9a6781afc.jpg",,"1/5PC Electronic Pet Nostalgic 49 Pets In One Virtual Cyber Digital Pet Toy Pixel Funny Play Toys Virtual","USD 3.99","USD 2.55","36%","USD","7","USD 0.18","0","null%","https://s.click.aliexpress.com/e/_DcwV6FV"
"1005003068612052","https://ae04.alicdn.com/kf/H1ad2514d82b943528c6b5fbcacc6b0957.jpg","http://cloud.video.taobao.com/play/u/2675628091/p/1/e/6/t/1/320025897288.mp4","Electronic pet machine Pet  electronic game machine Keychain pendant toy","USD 13.19","USD 6.59","50%","USD","8.0","USD 0.53","0","0.0%","https://s.click.aliexpress.com/e/_DFnug0R"
"1005004693915277","https://ae04.alicdn.com/kf/S4ad9a30246fa41428e5f4c00ee2040ff5.jpg","http://cloud.video.taobao.com/play/u/2675628091/p/1/e/6/t/1/1100084496150.mp4","DIY Rail Racing Track Electric Small Duck Climbing Stairs Toy Pig Action Figures Toys Music Roller Coaster Toy For Kids Gift","USD 15.98","USD 7.99","50%","USD","7","USD 0.56","0","null%","https://s.click.aliexpress.com/e/_DDjHuQb"
"1005003578527879","https://ae04.alicdn.com/kf/H3428dab777e54d6ab850e47bf84969fbn.jpg",,"Creative Electronic Pet Game Tamagotchi Toy 168 Pets In 1 Virtual Pet Electronic Toys Mini Handheld Game Children Gifts","USD 2.49","USD 1.99","20%","USD","7","USD 0.14","19","94.3%","https://s.click.aliexpress.com/e/_DciWyQ7"
"1005004169955532","https://ae04.alicdn.com/kf/S2dcac87150634a30a527eea2ff7c0fd5V.jpg","http://cloud.video.taobao.com/play/u/2675628091/p/1/e/6/t/1/1100084048060.mp4","Funny Electric Horse Music Walking White Horse Action Figure Toys Acousto-Optic Troubles Gift Toys for Children Baby Kids Pets","USD 3.15","USD 2.58","18%","USD","7","USD 0.18","1","100.0%","https://s.click.aliexpress.com/e/_DleJWaj"
"1005003531093689","https://ae04.alicdn.com/kf/H4c537e87d2f24d6c9e7a13bfd51f0a03O.jpg","http://cloud.video.taobao.com/play/u/2675628091/p/1/e/6/t/1/1100004310734.mp4","1PC Battery Powered Electronic Fish Swim Activated Fish Toy Pet for Fishing Tank Decorating Fish Dropshipping","USD 2.59","USD 2.46","5%","USD","15.0","USD 0.37","0","null%","https://s.click.aliexpress.com/e/_DdLwhYL"
"32847682069","https://ae04.alicdn.com/kf/HTB1xyw6klHH8KJjy0Fbq6AqlpXaH.jpg",,"[ Funny ] Electronic pet DIY Assemble Intelligent Electric Spider Robot Toy Educational DIY Kit Assembling Building Puzzle Toy","USD 12.63","USD 11.37","10%","USD","7","USD 0.80","1","0.0%","https://s.click.aliexpress.com/e/_DEszEUJ"
"1005003110213670","https://ae04.alicdn.com/kf/S822733cd1be34d86bdb454976bb5082cp.jpg",,"Cute Baby Phone Toy Mobile Telephone Early Educational Learning Machine Gifts Telephone Music Sound Machine Electronic Baby Toy","USD 3.04","USD 1.58","48%","USD","7","USD 0.11","0","null%","https://s.click.aliexpress.com/e/_DFq6ren"
"1005004691457656","https://ae04.alicdn.com/kf/Sadcb47b688dc42e1a30e450ce957d3b81.jpg",,"Gyro Game Machine Kids Toys Electronic Game Console Funny Christmas Gift Mini Handheld Games Console","USD 15.25","USD 12.05","21%","USD","7","USD 0.84","2","null%","https://s.click.aliexpress.com/e/_DBCPa8r"
"1005002950700983","https://ae04.alicdn.com/kf/H88243e2f0f4c4e93ab0b0023020c4e59c.jpg","http://cloud.video.taobao.com/play/u/2675628091/p/1/e/6/t/1/346551995583.mp4","Electronic Crazy Chicken Plush Toy Electric Funny Dancing Laying Eggs Hens Doll Music Animal for Kids Birthday Gift","USD 10.45","USD 5.96","43%","USD","7","USD 0.42","3","null%","https://s.click.aliexpress.com/e/_DEt09fD"
"1005004708063218","https://ae04.alicdn.com/kf/S5436ff1782a3411aabaed8edd1eb289am.jpg","http://cloud.video.taobao.com/play/u/2675628091/p/1/e/6/t/1/1100085415016.mp4","BANDAI Tamagotchi Smart Sanrio Characters Japan Special Set Limited Touch Screen Watch Electronic Pet Machine Action Figures Toy","USD 28.15","USD 17.45","38%","USD","7","USD 1.22","2","null%","https://s.click.aliexpress.com/e/_DlZQHXZ"
"1005004516417629","https://ae04.alicdn.com/kf/Se5103f9647f546a0a5c812ca4158ffcdl.jpg",,"Baby Crawling Crab Toy Mobile Crawling Crab Baby Toys Mobile Crab Crawling Toys Wind Up Crawling Crab Walking Crab Toy Gift For","USD 1.41","USD 0.99","30%","USD","7","USD 0.07","0","null%","https://s.click.aliexpress.com/e/_DD2eE2x"
"1005002354401850","https://ae04.alicdn.com/kf/H6f360a4b567c48aa96123c288d2ee277L.jpg","http://cloud.video.taobao.com/play/u/2675628091/p/1/e/6/t/1/303201654678.mp4","Electronic Music Pet Soft Stuffed Plush Cat Dancing &Singing Animal Toys  Robot Cat Kids Children Toys Birthday Christmas Gifts","USD 31.80","USD 22.90","28%","USD","8.0","USD 1.83","1","100.0%","https://s.click.aliexpress.com/e/_DmF5zeP"
"1005002777220077","https://ae04.alicdn.com/kf/Ha9d26f9a84e04244a726fca2ce4ddee2z.jpg","http://cloud.video.taobao.com/play/u/2675628091/p/1/e/6/t/1/313307305857.mp4","Electric Simulation Voice Control Parrot Toy Musical Magpie Talking Electronic Pet Bird Model Decoration Children'S Toy Gift","USD 22.45","USD 10.10","55%","USD","7","USD 0.71","6","100.0%","https://s.click.aliexpress.com/e/_DeDU9V5"
"1005004735905440","https://ae04.alicdn.com/kf/S7e8498b208ef4b79a9d2439900f20404y.jpg",,"Electronic Plush S Toy Cute Simulation Plush Toys Soft Stuffed Kitten Model For Kids Girls Birthday Valentine's Day C2d9","USD 6.98","USD 3.56","49%","USD","7","USD 0.25","0","null%","https://s.click.aliexpress.com/e/_DdS8slZ"
"1005004691487707","https://ae04.alicdn.com/kf/S4afbc6d80c214a2ca0a0512e27af3e56v.jpg",,"YOYO Fighter Game Machine Kids Toy Funny Christmas Gift Mini Handheld Portable Pocket Games Console","USD 10.30","USD 8.14","21%","USD","7","USD 0.57","0","null%","https://s.click.aliexpress.com/e/_DFNLxZN"
"1005003772724646","https://ae04.alicdn.com/kf/S0ee5e7fffdc849de960d7abdae43afe2S.jpg","http://cloud.video.taobao.com/play/u/2675628091/p/1/e/6/t/1/344797223526.mp4","Robot Dog Toy Electronic Plush Puppy Electric Sing Songs Animal Walk Bark Music Huskie Leash Controled Pet Kids Birthday Gift","USD 42.50","USD 25.50","40%","USD","8.0","USD 2.04","16","100.0%","https://s.click.aliexpress.com/e/_DEkbAf9"
"1005004738753802","https://ae04.alicdn.com/kf/S918a3c44ab554932af3cd03471523fca8.jpg",,"Dinosaur Projector Watch Creative Electronic Digital Wrist Watch For Kids Adjustable Date & Time Projector Watch Toys For Kids","USD 2.45","USD 1.71","30%","USD","7","USD 0.12","0","null%","https://s.click.aliexpress.com/e/_Degrtd9"
"1005004744095800","https://ae04.alicdn.com/kf/S6418910c1be64f52ab8c356626006280l.jpg",,"Electric Dancing Singing Cartoon Crazy Circus Handstand Clown Lights Music Boys Girls Electric Dolls Children's Puzzle Toys Gift","USD 29.11","USD 14.55","50%","USD","7","USD 1.02","0","null%","https://s.click.aliexpress.com/e/_DFDczif"
"1005004135121159","https://ae04.alicdn.com/kf/S695d9417214f424fa121921cb58af214f.jpg","http://cloud.video.taobao.com/play/u/2675628091/p/1/e/6/t/1/1100008662873.mp4","Cute Dancing Gentleman Duck Musical Lighting Doll Interactive Kids Early Educational Toy Gift","USD 6.09","USD 4.57","25%","USD","7","USD 0.32","3","100.0%","https://s.click.aliexpress.com/e/_DDvtyw7"
"1005003951734650","https://ae04.alicdn.com/kf/S825f1c8d9c37425da4500e209b0ce3fbj.jpg","http://cloud.video.taobao.com/play/u/2675628091/p/1/e/6/t/1/326395402678.mp4","1PCS Mini Cartoon Mobile Phone Early Educational Learning With Music Machine For Children Electronic Toy Gift Funny Cellphone","USD 2.18","USD 1.68","23%","USD","7","USD 0.12","0","null%","https://s.click.aliexpress.com/e/_DdwBAVv"
"1005004156631728","https://ae04.alicdn.com/kf/S200b15ee41cb47e9b8b2fb4f0e238cba9.jpg",,"Plush Electric Simulation Swing Fish Toy Jumping Fish 30CM 3D Interactive Dancing Fish Toys Funny Gift for Baby Little Kids Pets","USD 15.75","USD 7.09","55%","USD","7","USD 0.50","3","null%","https://s.click.aliexpress.com/e/_DeRhY2F"
"1005002495947317","https://ae04.alicdn.com/kf/H2a3fdb288f094be5833ef6f7e1a8c40dZ.jpg",,"Electronic Pets Cats Dolls Simulation Animal Toy Cat Meowth Children Cute Pet Plush Toy Model Ornaments Gift","USD 5.44","USD 3.26","40%","USD","7","USD 0.23","1","0.0%","https://s.click.aliexpress.com/e/_DlkLZzN"
"1005004041910296","https://ae04.alicdn.com/kf/Sbf5f075a312648dd8bedd896df8809cfb.jpg","http://cloud.video.taobao.com/play/u/2675628091/p/1/e/6/t/1/1100013683274.mp4","Electronic Knitted Singing Dancing Cactus Twisting Repeat Talking Plush Doll Funny Educational Desktop Decor 8 Songs Kid Toy","USD 8.55","USD 4.27","50%","USD","7","USD 0.30","4","100.0%","https://s.click.aliexpress.com/e/_DD1rRl5"
"1005004658816218","https://ae04.alicdn.com/kf/Sdff5102687734ccdbc9d6e6db646fa74e.jpg",,"Small Game Console Handheld Arcade Game Console with Keychain Built-in 26 Games Mini Video Gaming Player Puzzle Kids Toys","USD 1.06","USD 0.76","28%","USD","7","USD 0.05","0","null%","https://s.click.aliexpress.com/e/_DDlDLY7"
"1005003787210826","https://ae04.alicdn.com/kf/S9e9880c48c694ad6a8fbd01a001375317.jpg","http://cloud.video.taobao.com/play/u/2675628091/p/1/e/6/t/1/345428987540.mp4","Electronic Plush Cat Toy Robot Kitten Laughing Electric Animal Toys Rolling On The Ground Funny Pet For Children Birthdays Gift","USD 35.30","USD 15.88","55%","USD","8.0","USD 1.27","2","100.0%","https://s.click.aliexpress.com/e/_DmHnnpN"
"32901243240","https://ae04.alicdn.com/kf/HTB1BygtXvQypeRjt_bXq6yZuXXar.jpg",,"2 x Kids Plastic Two-Way Radio, Electronic Walkie Talkie Interphone Toy for Long Way Communication - Yellow","USD 5.53","USD 2.82","49%","USD","7","USD 0.20","0","0.0%","https://s.click.aliexpress.com/e/_DFsPmRl"
"1005004393815784","https://ae04.alicdn.com/kf/Sa56da40246734163b2aa6abd7582e9fbi.jpg","http://cloud.video.taobao.com/play/u/2675628091/p/1/e/6/t/1/1100047952359.mp4","Electric Dance Lighting Rotate Gear Space Rocket Early Educational Toy Musical Interactive Kids Gifts","USD 5.95","USD 4.76","20%","USD","7","USD 0.33","0","null%","https://s.click.aliexpress.com/e/_Dn3s3Hz"
"1005004442634560","https://ae04.alicdn.com/kf/Sa30b6d9ece2544f087c70a397254f18fV.jpg",,"1PC Mini Classic Game Machine Retro Nostalgic Game Console With Keychain Video Game Handheld Game Players Electronic Toys","USD 1.96","USD 1.35","31%","USD","10.0","USD 0.14","0","null%","https://s.click.aliexpress.com/e/_DdrVG3N"
"1005004595162601","https://ae04.alicdn.com/kf/S19114c6bb69f4671b819a36b7b29b60dZ.jpg",,"Electric Snakes Intelligent Induction Obstacle Avoidance Silver Ring Snake Cat Toys for Children Halloween Children's Day Gifts","USD 48.23","USD 19.29","60%","USD","7","USD 1.35","1","null%","https://s.click.aliexpress.com/e/_DlmiBc7"
"1005002292181392","https://ae04.alicdn.com/kf/H7dfc608c32854737860b277c2b498354q.jpg",,"2020 New Funny Swimming Electronic Fish Activated Battery Powered Pets Toy  Pet for Fishing Tank Decorating Bath Toys","USD 3.28","USD 2.46","25%","USD","21.0","USD 0.52","13","0.0%","https://s.click.aliexpress.com/e/_DFD65BD"
"4000438524447","https://ae04.alicdn.com/kf/H5fae37b5042c449a9a0b619b2119a930v.jpg","http://cloud.video.taobao.com/play/u/2675628091/p/1/e/6/t/1/337063469757.mp4","1Pc Funny Electronic Bullshit Loudspeaker Button Music Box Toy Party Supply","USD 2.00","USD 1.24","38%","USD","7","USD 0.09","0","0.0%","https://s.click.aliexpress.com/e/_DEjz48f"
"1005003122078485","https://ae04.alicdn.com/kf/H296d4b725bbf41fabb855cbad3abcc7ap.jpg",,"Interactive Electronic Pets Lovely Electronic Plush Toys Children's Electric Pet Cute Pigs Magnetic Induction Feeding","USD 8.50","USD 5.61","34%","USD","7","USD 0.39","1","100.0%","https://s.click.aliexpress.com/e/_DEVnayX"
"1000007876856","https://ae04.alicdn.com/kf/HTB1wwE3RyrpK1RjSZFhq6xSdXXam.jpg","http://cloud.video.taobao.com/play/u/2675628091/p/1/e/6/t/1/223905946909.mp4","Funny Electronic Singing Plastic Fish Battery Powered Robot Toy Simulation Fishes Novelty Spoof Toys Halloween Decorating Play","USD 35.50","USD 25.56","28%","USD","7","USD 1.79","14","96.0%","https://s.click.aliexpress.com/e/_DkR5Cdp"
"1005002797590840","https://ae04.alicdn.com/kf/H259c238dc9554c2db19acc0a14f2183bT.jpg","http://cloud.video.taobao.com/play/u/2675628091/p/1/e/6/t/1/314345923240.mp4","New Colorful Dance Penguin Shape Electric Home Kids Gift LED Light Musical Plastic Portable Cute Singing Toys","USD 4.47","USD 3.58","20%","USD","7","USD 0.25","2","0.0%","https://s.click.aliexpress.com/e/_DmxwX7Z"
"1005004516803619","https://ae04.alicdn.com/kf/Sddcabeefea394719b7b5e26e2e8756974.jpg","http://cloud.video.taobao.com/play/u/2675628091/p/1/e/6/t/1/1100073013416.mp4","2022 Latest 12 Constellation Electronic Pet Original E-pet Color Display Kid Gift Virtual Pet Interactive Toy Digital HD Screen","USD 15.62","USD 7.97","49%","USD","8.0","USD 0.64","78","98.9%","https://s.click.aliexpress.com/e/_DBZ9mnl"
"1005004718792158","https://ae04.alicdn.com/kf/S2c354018744c4a40a9c2b7afd362c5b3b.jpg","http://cloud.video.taobao.com/play/u/2675628091/p/1/e/6/t/1/1100086050210.mp4","Interactive Educational Whack A Mole Game Toys  Hammer Toy with Light Sound for Kids Play Knock Hit Hamster Desktop Game","USD 24.98","USD 15.49","38%","USD","7","USD 1.08","0","null%","https://s.click.aliexpress.com/e/_Deh03Sr"
"1005004310642558","https://ae04.alicdn.com/kf/Sfd2c09b68895475a8780fec2c0229c7bZ.jpg","http://cloud.video.taobao.com/play/u/2675628091/p/1/e/6/t/1/1100032609631.mp4","Boys Dinosaur Toys Dino Animal Model Electric soft bullet gun Shooting Tyrannosaurus Rex Kids Pet Children Birthday Gifts","USD 41.99","USD 27.71","34%","USD","9.0","USD 2.49","2","100.0%","https://s.click.aliexpress.com/e/_De4d0kn"
"1005003492748859","https://ae04.alicdn.com/kf/H2531d6ec46814abe8b05ace7becb7197V.jpg","http://cloud.video.taobao.com/play/u/2675628091/p/1/e/6/t/1/333810124028.mp4","Electronic Crazy Chicken Plush Toy Electric Funny Singing Dancing Laying Eggs Hens Doll Music Animal For Kids Christmas Gift","USD 19.00","USD 16.00","0%","USD","8.0","USD 1.28","0","null%","https://s.click.aliexpress.com/e/_DBQekdv"
"1005004652839618","https://ae04.alicdn.com/kf/S811e38c19ea9448e9b6a0c1433ab68a9B.jpg",,"Tamagotchi Electronic Pets 90S Nostalgic 168 Animals In One Virtual Cyber Toy Robot Dog Development Educational Funny Toys Gifts","USD 6.72","USD 4.30","36%","USD","7","USD 0.30","24","93.3%","https://s.click.aliexpress.com/e/_DBJklmX"
"1005003444791364","https://ae04.alicdn.com/kf/He3d8074a3cd34a20a87d97fccdff154ax.jpg",,"Electronic Robot Vivid Funny Long-lasting Walking Robot with Musical and Colorful Light","USD 4.65","USD 2.88","38%","USD","7","USD 0.20","0","null%","https://s.click.aliexpress.com/e/_DlMN6Pl"
"4001046304845","https://ae04.alicdn.com/kf/H01d0ba8e9ac94d9a92ffef279aa0d4c8l.jpg","http://cloud.video.taobao.com/play/u/2675628091/p/1/e/6/t/1/264209256054.mp4","Hot Electric Music Walking Duck Interactive Toys Kids Baby Girl Boy Educational Toy LED Light Glow Electronic Pets Toys Children","USD 7.13","USD 5.99","16%","USD","7","USD 0.42","2","60.0%","https://s.click.aliexpress.com/e/_DmSDUFN"
"1005004587317061","https://ae04.alicdn.com/kf/Sc4e17f4cb74c416ea78e9e597c16df94X.jpg",,"Crawling Crab Baby Toys With Music LED Light Up Musical Toys For Toddler Automatically Avoid Obstacles Interactive Toys For B7J8","USD 5.68","USD 3.41","40%","USD","7","USD 0.24","0","null%","https://s.click.aliexpress.com/e/_DeRFIyJ"
"1005003749018588","https://ae04.alicdn.com/kf/H191cf37b4b00468fb79bbfa1bd317a297.jpg",,"Talking Record Cute Parrot Waving Wings Electronic Pet  Stuffed Plush Toy Educational Toy for Kids Birthday Gift Boy Girl New","USD 6.95","USD 4.86","30%","USD","7","USD 0.34","0","null%","https://s.click.aliexpress.com/e/_Dn0vOQL"
"1005004008259904","https://ae04.alicdn.com/kf/Sce79ae87a6d44400bb86c9ea51e23087w.jpg","http://cloud.video.taobao.com/play/u/2675628091/p/1/e/6/t/1/351537775551.mp4","Electronic Pets 1PCs Transparent Nostalgic In One Virtual Cyber Toy Virtual Toys Electronic Robot Dog","USD 1.83","USD 1.10","40%","USD","7","USD 0.08","0","null%","https://s.click.aliexpress.com/e/_DE2lTRZ"
"32819381397","https://ae04.alicdn.com/kf/HTB1BbveSXXXXXbRXFXXq6xXFXXXo.jpg",,"Fun!!!  Electronic Pets Toys 90S Nostalgic 49 Pets in One Virtual Cyber Pet Toy Funny","USD 1.67","USD 1.59","5%","USD","7","USD 0.11","1","0.0%","https://s.click.aliexpress.com/e/_DeJlFhz"
"1005003116910950","https://ae04.alicdn.com/kf/Haf4964e356d5471d9ca24f483fd2fd64w.jpg",,"Classic Electronic Pet Toy Fun Virtual Network Toy Pet Development Game Machine Children Creative Gifts","USD 1.49","USD 0.76","49%","USD","7","USD 0.05","0","null%","https://s.click.aliexpress.com/e/_DDxGWEx"
"32657039779","https://ae04.alicdn.com/kf/Hd2ec8ee5c4cd4c9d8f638b2850181361d.jpg",,"Russian language electronic baby ABC alphabet sound poster infant kids present Gift early learning education phonetic chart","USD 13.20","USD 11.88","10%","USD","8.0","USD 0.95","81","100.0%","https://s.click.aliexpress.com/e/_DlTnpcL"
"1005004239352832","https://ae04.alicdn.com/kf/S6dad1669713846218f2b4d56731078f8L.jpg",,"Electronic Fish Pet Soft Shape Cat Toy Electric USB Charging Simulation Fish Toys Funny Cat Chewing Playing Supplies Dropshiping","USD 4.99","USD 4.94","1%","USD","7","USD 0.35","2","100.0%","https://s.click.aliexpress.com/e/_DFpZM2x"
