"ProductId","Image Url","Video Url","Product Desc","Origin Price","Discount Price","Discount","Currency","Commission Rate","Commission","Sales180Day","Positive Feedback","Promotion Url"
"1005002856084405","https://ae04.alicdn.com/kf/H2ae3280e1aa84cebb8ad0c360534d816r.jpg",,"Solar Shaking Head Apple Blossom Office Ornaments Bobble Head Doll Toys","USD 1.75","USD 1.05","40%","USD","7","USD 0.07","0","null%","https://s.click.aliexpress.com/e/_Dem1MnV"
"1005004118981192","https://ae04.alicdn.com/kf/S6ac56b23eaae4f75a88f89ec82fb770eR.jpg","http://cloud.video.taobao.com/play/u/2675628091/p/1/e/6/t/1/1100006863911.mp4","Electric Dancing Sing Cartoon Bee Lighting Music Animal Plastic Changing Face Honeybee Doll Gift Kids Toy","USD 9.21","USD 6.91","25%","USD","7","USD 0.48","1","null%","https://s.click.aliexpress.com/e/_DdVcj2J"
"1005004680199097","https://ae04.alicdn.com/kf/Sdc57c8646e17448b95c62abc3aaa87e8d.jpg",,"Crawling Octopus Baby Toy Induction Escape Octopus Toy Music Light Up Electric Pet Rechargeable Educational Toys Gift For K M7m6","USD 7.75","USD 5.04","35%","USD","7","USD 0.35","1","null%","https://s.click.aliexpress.com/e/_DB4l5vH"
"1005004431816682","https://ae04.alicdn.com/kf/Sa9843d00c856414e87cc925c96c6efa71.jpg",,"Sound Button Recordable Talking Button Bullshit Maybe No Sorry Yes Toys Home Office Party Funny Gag Toy For Children Toy Gifts","USD 2.51","USD 1.88","25%","USD","10.0","USD 0.19","0","null%","https://s.click.aliexpress.com/e/_DCtJnWB"
"1005002187327583","https://ae04.alicdn.com/kf/H6ca72c34c0814712855382eadb327069U.jpg","http://cloud.video.taobao.com/play/u/2675628091/p/1/e/6/t/1/298785005326.mp4","Lovely Electric Dance Duck Doll Children Educational Toy Musical Lighting Interactive Kids Gifts","USD 5.68","USD 4.54","20%","USD","7","USD 0.32","4","100.0%","https://s.click.aliexpress.com/e/_Dm4NQAx"
"1005004182366601","https://ae04.alicdn.com/kf/Se32166bd58a2495e9493df1cc7d9f6aev.jpg","http://cloud.video.taobao.com/play/u/2675628091/p/1/e/6/t/1/1100014310059.mp4","Dinosaur Egg Multi-colors Virtual Cyber Digital Pet Game Toy Tamagot Digital Electronic E-Pet Birthday Gift for Kids Adult","USD 1.79","USD 1.25","30%","USD","7","USD 0.09","4","100.0%","https://s.click.aliexpress.com/e/_DFvZmsR"
"1005004686892831","https://ae04.alicdn.com/kf/S38b53207eba14dd2bfb5d61805001402c.jpg","http://cloud.video.taobao.com/play/u/2675628091/p/1/e/6/t/1/1100084077765.mp4","Original Bandai Tamagotchi Dinosaur JURASSIC WORLD Tyrannosaurus Rex Triceratops Electronic Game Pet Machine Action Figures Toys","USD 49.91","USD 31.94","36%","USD","7","USD 2.24","14","null%","https://s.click.aliexpress.com/e/_DCsZ8z1"
"1005002360329836","https://ae04.alicdn.com/kf/H0d5f2e9219684b98a9711615cde81ae82.jpg","http://cloud.video.taobao.com/play/u/2675628091/p/1/e/6/t/1/303328530074.mp4","1pcs Electronic Pets Swing Toy Funny Plastic Anti-scratch Educational Simulation Lovely Rotation Swing Animal Toy for Kids","USD 3.49","USD 3.49","0%","USD","7","USD 0.24","0","null%","https://s.click.aliexpress.com/e/_DmeQRf1"
"1005004520841648","https://ae04.alicdn.com/kf/Sa3c00ac7560c45fcb8464b2c8c82458bj.jpg",,"Electronic Learning Smartphone Toy Preschool Learning Toy for Aged 18Months+","USD 2.95","USD 1.65","44%","USD","7","USD 0.12","0","null%","https://s.click.aliexpress.com/e/_DdnXDCT"
"1005003355328739","https://ae04.alicdn.com/kf/H420692d5e4bd46498a2d82b4ab418b10y.jpg",,"360 Rotating Smart Space Dance Robot Electronic Walking Toys With Music Light For Kids Astronaut Toy Christmas Birthday Gift","USD 13.16","USD 9.21","30%","USD","7","USD 0.64","3","null%","https://s.click.aliexpress.com/e/_DnstmZp"
"1005003493601381","https://ae04.alicdn.com/kf/H0c2876e19d904d0d949d8adaf602df5a5.jpg",,"Electric Puppy Plush Sing and Dance Toy, Leash Walking Electric Simulation Dog for Children Kids Gift","USD 14.21","USD 10.09","29%","USD","7","USD 0.71","0","null%","https://s.click.aliexpress.com/e/_Dmw9Bdd"
"1005003786236786","https://ae04.alicdn.com/kf/S9c9b0198ec304866b9aad8322afe79bdd.jpg","http://cloud.video.taobao.com/play/u/2675628091/p/1/e/6/t/1/344984498913.mp4","Robot Lion Toys Electronic Plush Animal Pet Walking Dancing Sing Song Electric Lion Music LED Toy For Children Birthday Gift","USD 47.90","USD 28.26","41%","USD","8.0","USD 2.26","4","100.0%","https://s.click.aliexpress.com/e/_DDW49HV"
"1005004496296352","https://ae04.alicdn.com/kf/S53cff425f6ed44e5bed3b75652a45d85c.jpg",,"1PC Electronic Pets Nostalgic 49 Pets In One Virtual Cyber Digital Pet Toys Pixel Funny Play Toys Virtual","USD 3.99","USD 2.55","36%","USD","7","USD 0.18","4","100.0%","https://s.click.aliexpress.com/e/_DDdgdgF"
"1005004587619360","https://ae04.alicdn.com/kf/S5f5e15ba89c24942b8dd08756f6590ea0.jpg",,"Parrot Talking Bird Toys Plush Repeating Electronic Animal Hanging Speaking Recording Statue Electric Pet Repeat Kids Learning","USD 19.60","USD 11.76","40%","USD","7","USD 0.82","3","null%","https://s.click.aliexpress.com/e/_DkmDCF9"
"1005004551415321","https://ae04.alicdn.com/kf/S0d5a1321daed4937b536bc8512edf775J.jpg","http://cloud.video.taobao.com/play/u/2675628091/p/1/e/6/t/1/1100069089629.mp4","Walking Barking Cute Puppy Pet Dog Toy with Battery Control Halloween Birthday Gift for Boys Girls Kawaii Electronic Plush Toys","USD 8.60","USD 5.68","34%","USD","7","USD 0.40","1","null%","https://s.click.aliexpress.com/e/_Dlza4UX"
"1005003951664347","https://ae04.alicdn.com/kf/S2e978d6400374d0a8be134e60bac1df4h.jpg",,"1PCs Tamagotchi Electronic Pets Gift Keyring Pets Toys Gift Christmas Educational Funny 90S Nostalgic Virtual Cyber Pet Toy","USD 2.87","USD 2.21","23%","USD","7","USD 0.15","0","null%","https://s.click.aliexpress.com/e/_Dl5T7Xv"
"1005003136161663","https://ae04.alicdn.com/kf/H64dc863cc0fe4de180130edd82c09c71Z.jpg","http://cloud.video.taobao.com/play/u/2675628091/p/1/e/6/t/1/322669611563.mp4","Rocking Animal Magnetic Electric Walking Interactive Cute Swinging Bear Magnetic Electronic Funny Educational Gift Toys For Kids","USD 2.73","USD 1.80","34%","USD","7","USD 0.13","0","null%","https://s.click.aliexpress.com/e/_DB1A1c3"
"1005003913802196","https://ae04.alicdn.com/kf/S86d8a76685094a478e9f22041b096c176.jpg",,"Electronic Pets Gift Keyring Pets Toys Gift Christmas Educational Funny 90S Nostalgic Virtual Cyber Pet Toy","USD 1.65","USD 1.65","0%","USD","7","USD 0.12","0","null%","https://s.click.aliexpress.com/e/_DdVCRLv"
"1005003882164023","https://ae04.alicdn.com/kf/Sdb20f2a84f6b499c8c9d32d552bbbdcfz.jpg",,"Infrared RC Animal Insect Toys Simulation Spider Bee Fly Crab Ladyb Mantis Electric Robot Toy Halloween Prank Insects Kids Toys","USD 21.23","USD 16.77","21%","USD","7","USD 1.17","1","null%","https://s.click.aliexpress.com/e/_Dc9Wclt"
"1005003691964954","https://ae04.alicdn.com/kf/H9e8b291a0c0a4973920a3b0a58dddccfn.jpg",,"1.5in Virtual Pet Toy for Children Pet Game Console Funny Kids Electronic Pets Toys USB Charging Digital Pet Toy Interactive Toy","USD 39.30","USD 18.47","53%","USD","7","USD 1.29","3","100.0%","https://s.click.aliexpress.com/e/_DFuMBh5"
"1005004056708569","https://ae04.alicdn.com/kf/Sc295200b433e490e871f67711c503812p.jpg","http://cloud.video.taobao.com/play/u/2675628091/p/1/e/6/t/1/351695084066.mp4","Interesting Electric Plush Rabbit Simulation Display Mold Can Walk Rabbit Robot Toys for Children Educational Electric Pets","USD 7.89","USD 4.97","37%","USD","7","USD 0.35","3","null%","https://s.click.aliexpress.com/e/_DmdhvDH"
"1005003159850754","https://ae04.alicdn.com/kf/Hc24ea546e76f48e6be55317556197afdt.jpg",,"1PCs Plastic Electric Kids Telephone Machine Cell Phone Toy Learning Machine Point Reading Machine Study Electronic Vocal Toys","USD 3.48","USD 2.37","32%","USD","7","USD 0.17","13","100.0%","https://s.click.aliexpress.com/e/_DnFNiGB"
"1005002964185466","https://ae04.alicdn.com/kf/H39cd7ad269404ad0baad2a6ac4b6b6b5Q.jpg","http://cloud.video.taobao.com/play/u/2675628091/p/1/e/6/t/1/320703430593.mp4","Electronic Shake Plush Dancing Cactus Toy Dance With Light Repeat Your words Bluetooth Speaker Child Education Toy Home Decor","USD 4.83","USD 2.90","40%","USD","8.0","USD 0.23","1","null%","https://s.click.aliexpress.com/e/_DeKHefN"
"1005002568368959","https://ae04.alicdn.com/kf/Hced5bbd31d9e4c6bb1f220772bd5d711I.jpg","http://cloud.video.taobao.com/play/u/2675628091/p/1/e/6/t/1/291160077903.mp4","Funny USB Charging Learn To Talk Repeat Duck Plush Toy Doll Birthday Gift For Adult Children 200 Songs Talking Dancing Recording","USD 20.91","USD 14.64","30%","USD","7","USD 1.02","2","0.0%","https://s.click.aliexpress.com/e/_DCWkuBz"
"1005004476939122","https://ae04.alicdn.com/kf/S298ac3ecaa0844afb6af770d4ff2ed39y.jpg",,"1pair/pack Toy Clear Sound Hiking Gift Interactive Long Range Portable Camping Outdoor Electronic 2 Way Radio Kid Walkie Talkie","USD 18.31","USD 11.90","35%","USD","7","USD 0.83","0","null%","https://s.click.aliexpress.com/e/_DCAFR3h"
"1005003507541178","https://ae04.alicdn.com/kf/H31c8373dae2e44869f8f3488240f065cF.jpg",,"Funny Dance Dog Electronic Walking Dancing Robot Dog Child Lighting Toy Musical Sound Light Gift Dog With Pet Toy H8b2","USD 5.54","USD 3.32","40%","USD","7","USD 0.23","0","null%","https://s.click.aliexpress.com/e/_DEhS7OP"
"10000423009557","https://ae04.alicdn.com/kf/U33034ca0feb144148887241b6a1589faP.jpg",,"Interactive toy Furby","USD 23.49","USD 23.49","0%","USD","7","USD 1.64","0","null%","https://s.click.aliexpress.com/e/_DFRl8qT"
"1005003558652593","https://ae04.alicdn.com/kf/H66806f8d0aa64373b1284ecde541e33fu.jpg",,"Smart Inductive Robot With Lights Follow Any Drawn Line Magic Pen Inductive Toy Electric Model Toys For Children Kids Gifts","USD 8.70","USD 6.00","31%","USD","7","USD 0.42","1","null%","https://s.click.aliexpress.com/e/_DmcUs1p"
"1005004767752707","https://ae04.alicdn.com/kf/S101a9fe7a9174867808ca0309937db88X.jpg",,"Talking Record Cute Parrot Waving Electronic Pet Stuffed Plush Toy Educational Toy For Kids Birthday Gift Boy Girl New L9H4","USD 6.74","USD 3.37","50%","USD","7","USD 0.24","0","null%","https://s.click.aliexpress.com/e/_DDldnPZ"
"1005004057074865","https://ae04.alicdn.com/kf/S1324d9edc03740829155ed3625dea631Q.jpg",,"2022 New  Realistic Pet Playhouse Doggy Toy Interactive Preschool Toy Girls Cartoon Gift","USD 8.30","USD 7.14","14%","USD","7","USD 0.50","0","null%","https://s.click.aliexpress.com/e/_DmZM9ux"
"1005004758551937","https://ae04.alicdn.com/kf/Sacd09e624a834dda81fbfd87c3e962daX.jpg",,"Christmas Twisting Toy Dancing Elk Santa Speak Electronic Plush Toys Songs Singing For Babies Children Toy Glowing Birthday K7l1","USD 8.19","USD 8.19","0%","USD","7","USD 0.57","0","null%","https://s.click.aliexpress.com/e/_DEcWkAF"
"1005004564431662","https://ae04.alicdn.com/kf/Sb3130e1767d64d88b6d75c7809ca1953k.jpg",,"Crawling Crab Baby Toys With Music LED Light Up Musical Toys For Toddler Automatically Avoid Obstacles Interactive Toys For L1L9","USD 5.29","USD 3.44","35%","USD","7","USD 0.24","0","null%","https://s.click.aliexpress.com/e/_DCmEwsX"
"1005003908474005","https://ae04.alicdn.com/kf/S5dad0add3e1b4dcdb6fe65fd4e5b3b1fl.jpg","http://cloud.video.taobao.com/play/u/2675628091/p/1/e/6/t/1/350589869437.mp4","Dropshipping!Electric Animal Toy Adorable Appearance Directional Rotation Plastic Cartoon Animal Music light Model Toy for Kids","USD 4.05","USD 1.62","60%","USD","8.0","USD 0.13","0","null%","https://s.click.aliexpress.com/e/_DcvsTTv"
"1005002131374058","https://ae04.alicdn.com/kf/Hb045d99cd9ea4224af9e50798c8e5d2ai.jpg",,"2pcs Toy Walkie Talkies Long Distance Handheld Wireless Intercom Phone LCD Display Electronic Children Kids Gifts","USD 10.78","USD 5.50","49%","USD","7","USD 0.38","0","null%","https://s.click.aliexpress.com/e/_DCGxVIR"
"1005004740327983","https://ae04.alicdn.com/kf/Sa909011337de42c1a0f6e515b7730792E.jpg",,"Tummy Time Light Up Crab with Music LED USB Charging Interactive Crawling Crab Avoid Obstacles Sensory Moving Toys Birthday Gift","USD 5.99","USD 4.19","30%","USD","7","USD 0.29","0","null%","https://s.click.aliexpress.com/e/_DmL3hNl"
"1005003320761224","https://ae04.alicdn.com/kf/Hda05f1b2f0e64b7094d8188a58ef4cfeY.jpg",,"Children's Enlightenment Electronic Toys Mobile Phone Educational Learning Toys Music Sound Machine Baby Toys Random Colors","USD 6.01","USD 4.81","20%","USD","7","USD 0.34","0","null%","https://s.click.aliexpress.com/e/_Dmgm4OF"
"1005004674094752","https://ae04.alicdn.com/kf/S71e2bb266fce41a9a1944c2f8dcaa63eo.jpg",,"Electric Duck Climbing Stairs Slides Set With Music Race Car Tracks Roller Coaster Kids Educational Toys Cute Toy Gift","USD 7.11","USD 4.98","30%","USD","8.0","USD 0.40","0","null%","https://s.click.aliexpress.com/e/_DkBz2vh"
"1005003879123215","https://ae04.alicdn.com/kf/S88e15381b60046ddbe9d8522b3396653u.jpg","http://cloud.video.taobao.com/play/u/2675628091/p/1/e/6/t/1/347047241465.mp4","Robot Cat Light Control Kitty Toys Electronic Plush Cat Interactive Kitten Shake Head Robotic Animal Pet For Kids Birthday Gift","USD 30.00","USD 16.50","45%","USD","8.0","USD 1.32","1","null%","https://s.click.aliexpress.com/e/_Devab8x"
"1005003686415553","https://ae04.alicdn.com/kf/H5e137e42dc88446f8e3c39636e201ac3K.jpg",,"Cartoon Telephone Story Machine Simulation Electronic Educational Toys Sound Game Mole Attack Pull Toy Development Gift","USD 6.25","USD 3.87","38%","USD","7","USD 0.27","0","null%","https://s.click.aliexpress.com/e/_DnsQzyT"
"1005004727655345","https://ae04.alicdn.com/kf/S89ae02ef6f8a4677af77a50bed01190af.jpg",,"1 Set Stair Climbing Toy Multi-layer Track Motivational Cognitive Development Playful Roller Coaster for Home","USD 3.21","USD 2.18","32%","USD","7","USD 0.15","0","null%","https://s.click.aliexpress.com/e/_DmANY8n"
"1005001866255168","https://ae04.alicdn.com/kf/He4425fbe237e4461b93f4d7d341f98b3o.jpg",,"Electronic Pets Robot Dog Walking Plush Colorful Pet Barking Mimicry Interactive Toy for Kids Child Christmas Gift Fun Eject","USD 1.35","USD 0.93","31%","USD","7","USD 0.07","0","null%","https://s.click.aliexpress.com/e/_DlNdLiP"
"1005002895661991","https://ae04.alicdn.com/kf/H6aef2837a28344c4a9f9807fb3c7b566V.jpg","http://cloud.video.taobao.com/play/u/2675628091/p/1/e/6/t/1/317415023841.mp4","Fun Electric Rolling Monkey Robot Toy Voice Control Lighting Music Somersault Child Baby Interactive Toys for Kids Toddler Girls","USD 13.73","USD 7.82","43%","USD","7","USD 0.55","2","null%","https://s.click.aliexpress.com/e/_Dl4KhFp"
"1005003795003149","https://ae04.alicdn.com/kf/Sba3297a0ee844973bf88fd967e36c801Q.jpg",,"224Pcs Flash Cards Learning Machine Musical Educational Electronic Toy Interactive Toys with Sound Effects Audible for Age 2-6","USD 9.26","USD 5.65","39%","USD","7","USD 0.40","3","null%","https://s.click.aliexpress.com/e/_DeBGbjt"
"4000265613808","https://ae04.alicdn.com/kf/H35db8e8bd8264f96bdeeb2737f05e365I.jpg","http://cloud.video.taobao.com/play/u/2675628091/p/1/e/6/t/1/238951872239.mp4","Lighting, music, children's animal model, toy, voice control, cartoon, banana monkey toys for kids toys","USD 3.54","USD 3.54","0%","USD","7","USD 0.25","0","0.0%","https://s.click.aliexpress.com/e/_DDsHAIF"
"1005004297916312","https://ae04.alicdn.com/kf/S9958abf1c2944642a5221347816a3500r.jpg",,"Electric Duckling Stair Climbing Toys Climbing Stairs And Slides Playset Electric Slide Roller Coaster Set For 3 4 5 6-Year-Old","USD 16.91","USD 8.45","50%","USD","7","USD 0.59","0","null%","https://s.click.aliexpress.com/e/_DeniAQ3"
"1005003801189029","https://ae04.alicdn.com/kf/Sbdaa61504a91433d81d2544b26e064766.jpg","http://cloud.video.taobao.com/play/u/2675628091/p/1/e/6/t/1/345827779664.mp4","Music Electronic Tank Toy Simulation Military Tank Track Inertia Electric Car Launch Cannonball Funny Educational Toy For Kids","USD 80.80","USD 48.48","40%","USD","8.0","USD 3.88","1","null%","https://s.click.aliexpress.com/e/_DdiDbKR"
"1005003737271796","https://ae04.alicdn.com/kf/S29a52cd1f8164d46bb20b1835d398a43W.jpg","http://cloud.video.taobao.com/play/u/2675628091/p/1/e/6/t/1/1100015395287.mp4","Baby Crawling Crab Toy Sensor Electronic Crab Toy With Sound Music And Lights Crawling Toys For Babies 6-12 Months Interactive T","USD 15.06","USD 10.54","30%","USD","7","USD 0.74","5","100.0%","https://s.click.aliexpress.com/e/_DEW0595"
"1005004737993198","https://ae04.alicdn.com/kf/S1576114af6ae479b808a6f4aada04fd9G.jpg",,"Tummy Time Interactive Crawling Crab Educational USB Charging Electric Crawling Crab with Music LED Sensory Moving Toys for Kids","USD 5.32","USD 3.56","33%","USD","7","USD 0.25","0","null%","https://s.click.aliexpress.com/e/_Dml8KF9"
"1005004448421166","https://ae04.alicdn.com/kf/S537b912fbce54c60902f9540656311ed3.jpg",,"Electric Battery Operated Birds Toys Simulated Induction Sound Control Voice Control Interactive Simulation Bird Toys","USD 6.33","USD 4.43","30%","USD","7","USD 0.31","0","null%","https://s.click.aliexpress.com/e/_De6A8zD"
"1005003632658702","https://ae04.alicdn.com/kf/H1357429e995445aab859579849303944X.jpg","http://cloud.video.taobao.com/play/u/2675628091/p/1/e/6/t/1/339182197013.mp4","Cartoon Electronic Music Walking Tiger Toys Cute LED Light Glow Electrical Pets for Children Animal Dolls Kids Birthday Gifts","USD 15.36","USD 9.98","35%","USD","7","USD 0.70","0","null%","https://s.click.aliexpress.com/e/_DCy41AX"
"1005004739926920","https://ae04.alicdn.com/kf/Sbc25530ad06c4ad19493480ec5f71b1ff.jpg",,"Electronic Plush Cats Toy Cute Simulation Cat Plush Toys Soft Stuffed Kitten Model For Kids Girls Birthday Valentine's Day G7E0","USD 7.29","USD 4.37","40%","USD","7","USD 0.31","0","null%","https://s.click.aliexpress.com/e/_DEbQLKJ"
"1005002351589284","https://ae04.alicdn.com/kf/He93dde31d1cc4bf99602826fc0e06d574.jpg",,"TOMY Genuine Rizmo Plush Toy Cute Doll Interactive To Develop Smart Electronic Pet","USD 100.00","USD 70.00","30%","USD","7","USD 4.90","2","null%","https://s.click.aliexpress.com/e/_DkBr1WP"
"1005003772920038","https://ae04.alicdn.com/kf/S0e7179ce73e741db9f04c32316c5ed65C.jpg","http://cloud.video.taobao.com/play/u/2675628091/p/1/e/6/t/1/344386118890.mp4","Electronic Plush Dog Toy Robot Puppy Electric Sing Songs Animal Walk Bark Music Huskie Leash Controled Pet Kids Birthday Gift","USD 42.50","USD 25.50","40%","USD","8.0","USD 2.04","2","80.0%","https://s.click.aliexpress.com/e/_Dn0rvGF"
"1005003717192329","https://ae04.alicdn.com/kf/S261f0b3ef2a74a249e64e1cb1f664fdd7.jpg","http://cloud.video.taobao.com/play/u/2675628091/p/1/e/6/t/1/341575260208.mp4","Electric Duck Climbing Stairs Toy Children Roller Coaster Toy Set Educational Light Music Amusement Climb Stairs Track Kids Toy","USD 4.84","USD 2.42","50%","USD","7","USD 0.17","1","0.0%","https://s.click.aliexpress.com/e/_DDO5WZh"
"1005003297508498","https://ae04.alicdn.com/kf/Ha7b3fd937ce14548b59ab51c9ec4a17aL.jpg","http://cloud.video.taobao.com/play/u/2675628091/p/1/e/6/t/1/320703430593.mp4","Dancing Cactus 120 Song Speaker Talking USB Charging Voice Repeat plush Cactu Dancer toy talk Plushie Stuffed toys for Baby Girl","USD 4.14","USD 2.90","30%","USD","8.0","USD 0.23","11","95.0%","https://s.click.aliexpress.com/e/_DlIo9Rt"
"1005003630863734","https://ae04.alicdn.com/kf/Sb72c38e0aded460ca384468fd8e57071v.jpg",,"Talking Smart Robot USB Charging LED Eye Interactive Children's Toy Gesture Sensor Toy Kids Birthday Gifts electronic toys","USD 14.99","USD 11.99","20%","USD","7","USD 0.84","14","88.0%","https://s.click.aliexpress.com/e/_DFZ7Ka3"
"1005004710488280","https://ae04.alicdn.com/kf/Sc5f97bacb3fc4389bcabdc53be799fee3.jpg",,"Kids Mini Electronic Piano Keyboard Musical Cartoon Pattern Kids Baby Music Electric Early Learning Electronic Baby Toys Gift","USD 26.00","USD 13.00","50%","USD","8.0","USD 1.04","2","null%","https://s.click.aliexpress.com/e/_Dd7GtIB"
"1005003853116340","https://ae04.alicdn.com/kf/Saedddcc991d54637b3855820208dda158.jpg",,"Original Little Live Pets Lil’Hedgehog House Lil’Fluffy Squirrel Rabbit Interactive Toys for Kids Electronic Girls Toys Pets","USD 34.58","USD 19.02","45%","USD","8.0","USD 1.52","9","null%","https://s.click.aliexpress.com/e/_DlHblsj"
"1005002798840642","https://ae04.alicdn.com/kf/S0dcf7b6667834fd18f0860e61afecd758.jpg",,"Developing Children'S Camera Bunny  Child'S Digital Photo Mini Educational Toy For Kids Games And Hobbies Electronic Toys Baby New Year Gift Birthday Projection Videocamera Optosha","USD 21.75","USD 13.05","40%","USD","7","USD 0.91","17","75.6%","https://s.click.aliexpress.com/e/_DCxBLCx"
"32939177164","https://ae04.alicdn.com/kf/HTB1YFQvXcfrK1RkSmLyq6xGApXaw.jpg","http://cloud.video.taobao.com/play/u/2675628091/p/1/e/6/t/1/210312158558.mp4","Electronic Pets Musical Elephant Toys Can Sing Walk Interactive Electric Sound Pets Animals Electronic Toys for Kids Gifts 1PCS","USD 11.00","USD 9.57","13%","USD","7","USD 0.67","2","0.0%","https://s.click.aliexpress.com/e/_DEwAvpz"
"1005004735881174","https://ae04.alicdn.com/kf/S7a19387429fe4695ad4d23775ecc270dE.jpg",,"Electronic Plush S Toy Cute Simulation Plush Toys Soft Stuffed Kitten Model For Kids Girls Birthday Valentine's Day E6x8","USD 8.24","USD 4.20","49%","USD","7","USD 0.29","0","null%","https://s.click.aliexpress.com/e/_DFCNmPN"
"1005004558086972","https://ae04.alicdn.com/kf/Sac8c03fca5aa4dc3b4c44ceaa4cb50d6b.jpg","http://cloud.video.taobao.com/play/u/2675628091/p/1/e/6/t/1/1100069846094.mp4","Electronic Digital Pet Game Console 90S Virtual Cyber E-pet Educational Toy Virtual Cyber Digital Pet Toys Pixel Funny Play Toys","USD 23.74","USD 16.14","32%","USD","7","USD 1.13","4","100.0%","https://s.click.aliexpress.com/e/_DknJhxZ"
"1005003189122050","https://ae04.alicdn.com/kf/Hbe631c8b16164deea0dfa1968da66942R.jpg",,"Whac-A-Mole Toy Electric Key Chain Party Gift Interactive Realistic Catching Toy with Light Music Button Battery Supply","USD 1.53","USD 1.19","22%","USD","7","USD 0.08","1","null%","https://s.click.aliexpress.com/e/_DcjGdWr"
"1005004427678591","https://ae04.alicdn.com/kf/Sbf34152e2b864479b482a4e8160b56abM.jpg",,"Remote Control Dinosaur Toy Boy Runaway Intelligent Electric Realistic Sound Effect Robot Toy Toys for Children","USD 16.50","USD 16.50","0%","USD","7","USD 1.16","0","null%","https://s.click.aliexpress.com/e/_Dc7HsLN"
"1005002976398411","https://ae04.alicdn.com/kf/H8badbc5ebe5741a58853935f145b63c8d.jpg","http://cloud.video.taobao.com/play/u/2675628091/p/1/e/6/t/1/318647699734.mp4","Tamagotchi Electronic Pets Gift Keyring Pets Toys Gift Christmas Educational Funny 90S Nostalgic Virtual Cyber Pet Toy","USD 2.25","USD 1.35","40%","USD","7","USD 0.09","2","0.0%","https://s.click.aliexpress.com/e/_DkICuph"
"1005004670233209","https://ae04.alicdn.com/kf/S7d22f091ca2a4e94b07e6ef6b27d4ddaq.jpg","http://cloud.video.taobao.com/play/u/2675628091/p/1/e/6/t/1/1100082888540.mp4","Baby Musical Turtle Toy Laying Eggs Turtle Toddler Crawling Toys Electric Infant Development Educational Toys Kids Birthday Gift","USD 29.12","USD 14.56","50%","USD","10.0","USD 1.46","0","null%","https://s.click.aliexpress.com/e/_DFrJN7v"
"1005004055229458","https://ae04.alicdn.com/kf/S43649668e0804b289b94ce11342a916fC.jpg",,"Escape Crab Induction Musical/Crawling Children Toys Moving Toy For Toddler Babies by Boys Girls","USD 7.23","USD 4.70","35%","USD","7","USD 0.33","0","null%","https://s.click.aliexpress.com/e/_DByJdOn"
"1005003320069723","https://ae04.alicdn.com/kf/H31f3afb9578d495cb0189190c5bef125z.jpg",,"Electric Plush Cat Cognitive Ability Interactive Ability Fine Workmanship Barking Walking Electric Cat Plush Toys for Kids","USD 4.49","USD 3.05","32%","USD","7","USD 0.21","1","100.0%","https://s.click.aliexpress.com/e/_DFb0PHl"
"1005004270765247","https://ae04.alicdn.com/kf/Sf672a58819794c1a8a2ad84691f275cff.jpg","http://cloud.video.taobao.com/play/u/2675628091/p/1/e/6/t/1/1100026579206.mp4","Kids Inductie Escape Krab Octopus Kruipen Speelgoed Baby Elektronische Huisdieren Muzikaal Speelgoed Educatief Peuter Moving Toy","USD 23.00","USD 11.50","50%","USD","7","USD 0.80","8","null%","https://s.click.aliexpress.com/e/_DDe3YwL"
"1005004049647786","https://ae04.alicdn.com/kf/S084f85f4f64f42b3b6c9fa8cafc84d06e.jpg","http://cloud.video.taobao.com/play/u/2675628091/p/1/e/6/t/1/1100017866329.mp4","Dancing Cactus Electron Plush Toy Soft Plush Doll Babies Cactus That Can Sing And Dance Voice Interactive Bled Stark Toy For Kid","USD 12.80","USD 9.60","25%","USD","10.0","USD 0.96","215","95.8%","https://s.click.aliexpress.com/e/_Dm4SkJz"
"1005004041908256","https://ae04.alicdn.com/kf/Sbdb8d6de4c7248788f2ce7d760fe1f4c3.jpg","http://cloud.video.taobao.com/play/u/2675628091/p/1/e/6/t/1/1100025361160.mp4","USB Dancing Cactus Toys Speak Electronic Plush Toys Twisting Dancer Talking Novelty Funny 120 English songs Music Lighting Gifts","USD 6.92","USD 3.46","50%","USD","7","USD 0.24","7","100.0%","https://s.click.aliexpress.com/e/_DmYvEA7"
"1005003994824915","https://ae04.alicdn.com/kf/Sf9e52d2758a941ceb55d664d4cb65cf7v.jpg",,"Bubble Maker Parent-Child Interaction Eco-friendly Interactive Toy Bubble Sprayer Machine Children Toy","USD 6.22","USD 4.04","35%","USD","7","USD 0.28","0","null%","https://s.click.aliexpress.com/e/_Dd7uVRD"
"1005004674262873","https://ae04.alicdn.com/kf/S976c008e34a0425da72c0201dc222e86W.jpg","http://cloud.video.taobao.com/play/u/2675628091/p/1/e/6/t/1/1100083221025.mp4","Electric Toys Jump Rabbit Automatic Crawling Bunny Colorful Light Music Simulation Jumping Rabbit Pet Infant Toddler Toys Gift","USD 21.54","USD 10.77","50%","USD","10.0","USD 1.08","0","null%","https://s.click.aliexpress.com/e/_DBBxNSB"
"4001227224018","https://ae04.alicdn.com/kf/Hff023746b4194122857c06a1ea325281F.jpg","http://cloud.video.taobao.com/play/u/2675628091/p/1/e/6/t/1/270990892674.mp4","Electric Walking Crocodile Dinosaur Music Light Dance Animal Doll Funny Children Toys Kids Birthday Gift","USD 6.07","USD 4.55","25%","USD","7","USD 0.32","1","null%","https://s.click.aliexpress.com/e/_DFJmVEf"
